¶ Sũmaire/ ⁊ briefue	¶ Summaire/ et briefve
Dieu/ suyuãtz sa saincte parolle sõ	Dieu/ suyvantz sa saincte parolle son
demẽtz/ soy gardantz de uenir con¬	dementz/ soy gardantz de venir con¬
tre la uolunte de nostre Seigͬ. Et	tre la volunte de nostre Seigneur. Et
leur salut. Et pour dispenser ce q̃	leur salut. Et pour dispenser ce que
en distribuera aux siens/ les incitãt	en distribuera aux siens/ les incitant
a paix ⁊ toute amytie/ ⁊ charite en¬	a paix et toute amytie/ et charite en¬
dele/ ⁊ prudẽt amy qui puisse ayder	dele/ et prudent amy qui puisse ayder
ment/ il les luy recõmandera/ sans	ment/ il les luy recommandera/ sans
cõmander a persõne de prẽdre au¬	commander a personne de prendre au¬
Seigneur Iesus/ ne de courir ca ne	Seigneur Jesus/ ne de courir ca ne
ure en laq̃lle selon Dieu peuuẽt ui	vre en laquelle selon Dieu peuvent vi¬
ure/ ⁊ non autremẽt. Ne cõmandãt	vre/ et non autrement. Ne commandant
soy: car il ne ueult oster a Dieu sõ	soy: car il ne veult oster a Dieu son
ment il fault dõner a ceulx qui ont	ment il fault donner a ceulx qui ont
necessite/ comme il commande.	necessite/ comme il commande.
Seigñr/ arme de la iustice de Iesu¬	Seigneur/ arme de la justice de Jesu¬
sus est tout nostre/ en ioye desperit	sus est tout nostre/ en joye d’esperit
prẽt son repos/ louãt ⁊ remerciãt ce	prent son repos/ louant et remerciant ce
ses miseres/ le tirãt hors de ce corps	ses miseres/ le tirant hors de ce corps
plus: mais reposera attendãt la re¬	plus: mais reposera attendant la re¬
surrection de son corps/ ou pleine¬	surrection de son corps/ ou pleine¬
cachee en nostre Seigneur Iesus.	cachee en nostre Seigneur Jesus.
Chap̃.xli.	Chapitre.xli.
L	L¬
sericorde/ qui a tout faict	sericorde/ qui a tout faict
portant ⁊ souffrãt en grã	portant et souffrant en gran¬
de patience ⁊ tolerance les enfãs de	de patience et tolerance les enfans de
ses tresgrãdes richesses de bõte/ mi	ses tres grandes richesses de bonte/ mi¬
de misericorde: lesq̃lz il a esleu ⁊ or¬	de misericorde: lesquelz il a esleu et or¬
donne a la uie auant le cõmẽcemẽt	donne a la vie avant le commencement
tent en leurs propres corps/ poͬ la	tent en leurs propres corps/ pour la
table des reprouuez ⁊ infideles/ et	table des reprouvez et infideles/ et
pour la merueilleuse ioye/ gloire/	pour la merveilleuse joye/ gloire/
esleu. Car ainsi q̃ les infideles sont	esleu. Car ainsi que les infideles sont
Dieu/ uoulãtz abbatre ⁊ destruire	Dieu/ voulantz abbatre et destruire
ce q̃ Dieu a faict ⁊ ordõne/ ilz doi¬	ce que Dieu a faict et ordonne/ ilz doi¬
ce diniquite.	ce d’iniquite.
seruy ⁊ fructifie) soit manifestee en	servy et fructifie) soit manifestee en
leurs corps: non point mort corpo¬	leurs corps: non point mort corpo¬
ueritable ⁊ fidele selon sa promesse	veritable et fidele selon sa promesse
siens/ les faisant semblables a son	siens/ les faisant semblables a son
filz. Car aĩsi qͥl est resuscite de mort	filz. Car ainsi qu’il est resuscite de mort
ainsi tous ses mẽbres qͥ par uraye	ainsi tous ses membres qui par vraye
incorruption ⁊ immortalite en grã	incorruption et immortalite en gran¬
de gloire. Car cõme la mort na peu	de gloire. Car comme la mort n’a peu
te: aussi elle ne peult faire que tous	te: aussi elle ne peult faire que tous
nẽt ⁊ uiuẽt en leurs propres corps	nent et vivent en leurs propres corps
en immortalite.	en immortalite.
sachantz que de nous: ⁊ de tout ce qͥ	sachantz que de nous: et de tout ce qui
seriõs aussi malheureux que les re	serions aussi malheureux que les re¬
prouuez: ⁊ q̃ par la grace de nostre	prouvez: et que par la grace de nostre
separez des perdus ⁊ miserables/ ⁊	separez des perdus et miserables/ et
gnons point de mettre ce corps poͬ	gnons point de mettre ce corps pour
lhonneur de nostre pere/ de mettre	l’honneur de nostre pere/ de mettre
euangile. Car pour uray il nous	evangile. Car pour vray il nous
excellent/ et telle uie quon ne scau¬	excellent/ et telle vie qu’on ne scau¬
roit estimer.	roit estimer.
teurs/ de la parolle de Dieu/ ayez	teurs/ de la parolle de Dieu/ ayez
preste/ le triumphe ordonne auec le	preste/ le triumphe ordonne avec le
grand capitaine Iesus. Ne tournez	grand capitaine Jesus. Ne tournez
se. Entrez hardimẽt dedãs poͬ lhõ	se. Entrez hardiment dedans pour l’hon¬
qui nous regarde/ uoire duquel est	qui nous regarde/ voire duquel est
la bataille/ ⁊ qui bataille en nous/	la bataille/ et qui bataille en nous/
esperit tandis que nous allõs bien.	esperit tandis que nous allons bien.
arrestez point aux choses uisibles ⁊	arrestez point aux choses visibles et
presẽtes: mais aux inuisibles ⁊ qui	presentes: mais aux invisibles et qui
¶ Du iour du iugement.	¶ Du jour du jugement.
L	L¬
A pleine reuelation de la	A pleine revelation de la
bien/ salut ⁊ uie: ⁊ la con	bien/ salut et vie: et la con¬
quoy toute creature souspire/ sera	quoy toute creature souspire/ sera
en laduenemẽt triumphãt ⁊ tresui¬	en l’advenement triumphant et tres vi¬
pteur/ quand tous ses ennemys se¬	pteur/ quand tous ses ennemys se¬
luy sera faict subiect/ lors les esleuz	luy sera faict subject/ lors les esleuz
uiendrõt au deuãt de nostre Seigͬ	viendront au devant de nostre Seigneur
gloire ⁊ puissance de nostre Sei¬	gloire et puissance de nostre Sei¬
Quelle ãgoisse ⁊ destresse a ceulx	Quelle angoisse et destresse a ceulx
qui lõt persecute/ le hayssãt a mort/	qui l’ont persecute/ le hayssant a mort/
uie/ ⁊ de maluueillance/ le mettant	vie/ et de malvueillance/ le mettant
faict/ en cõmenceant au p̃mier iuste	faict/ en commenceant au premier juste
Abel en continuant es autres/ ⁊ en	Abel en continuant es autres/ et en
nissant au dernier iuste ⁊ esleu. Car	nissant au dernier juste et esleu. Car
faict au corps de Iesus: car ilz sont	faict au corps de Jesus: car ilz sont
son corps/ chair de sa chair/ et os de	son corps/ chair de sa chair/ et os de
goisse? Mais laissons ce pensemẽt	goisse? Mais laissons ce pensement
des fideles: sinon quen ce aurõs oc¬	des fideles: sinon qu’en ce aurons oc¬
casion de rendre graces a nostre bõ	casion de rendre graces a nostre bon
du millieu diceulx pour estre des	du millieu d’iceulx pour estre des
merites: mais par sa grace et bonte	merites: mais par sa grace et bonte
infinie.	infinie.
brez au liure de uie auãt que le mõ¬	brez au livre de vie avant que le mon¬
par adoption ⁊ grace/ separez des	par adoption et grace/ separez des
mauuais/ et mis a la dextre en	mauvais/ et mis a la dextre en
ne de doulceur grace ⁊ misericorde.	ne de doulceur grace et misericorde.
mon pere: ausq̃lz par moy ilz a don	mon pere: ausquelz par moy ilz a don¬
ne sa benediction cõme il auoit pro¬	ne sa benediction comme il avoit pro¬
me qui uous est appreste des le cõ¬	me qui vous est appreste des le com¬
Icy uoys tu que ceulx uiẽnẽt a	Icy voys tu que ceulx viennent a
Iesus/ ⁊ sõt faictz heritier de Dieu	Jesus/ et sont faictz heritier de Dieu
pere. Lesquelz il auoit promis a	pere. Lesquelz il avoit promis a
sus) ilz seroient beneitz. Ausquelz le	sus) ilz seroient beneitz. Ausquelz le
royaume des cieulx est appreste des	royaume des cieulx est appreste des
tu dois entendre iceulx estre seule¬	tu dois entendre iceulx estre seule¬
quelz il dõne sa benediction par Ie	quelz il donne sa benediction par Je¬
sus/ les unissant a iceluy. Car de la	sus/ les unissant a iceluy. Car de la
tous recoiuẽt par foy qui sõt ses mẽ	tous recoivent par foy qui sont ses mem¬
des le cõmencemẽt du monde. Car	des le commencement du monde. Car
auant q̃ le monde feust cree Dieu a	avant que le monde feust cree Dieu a
il ne dit pas: Uenez circonciz ⁊ ba¬	il ne dit pas: Venez circonciz et ba¬
stres ⁊ disciples/ ou nommez Iuifz	stres et disciples/ ou nommez Juifz
ou Chrestiens/ qui auez este telz ou	ou Chrestiens/ qui avez este telz ou
il dit: Uenez/ uous a qui mon pere	il dit: Venez/ vous a qui mon pere
royaume des le cõmencemẽt du mõ	royaume des le commencement du mon¬
de. Car rien ne peult empescher lele	de. Car rien ne peult empescher l’ele¬
ble/ soit que celuy quil a ordonne a	ble/ soit que celuy qu’il a ordonne a
Turquie/ auquel meure dedans le	Turquie/ auquel meure dedans le
uentre de sa mere. Puis quil est or¬	ventre de sa mere. Puis qu’il est or¬
dans le uentre de sa mere auec Ia¬	dans le ventre de sa mere avec Ja¬
Car lelection ⁊ grace de Dieu ⁊ son	Car l’election et grace de Dieu et son
esperit (duquel il sanctifie les siens	esperit (duquel il sanctifie les siens
cun lieu/ aucunes personnes/ aucu¬	cun lieu/ aucunes personnes/ aucu¬
mẽt sans aucunz regard/ ne des pa¬	ment sans aucunz regard/ ne des pa¬
rens/ ne des gens/ ou lieux/ ne de la	rens/ ne des gens/ ou lieux/ ne de la
le donne.	le donne.
aux ĩfideles ⁊ reprouuez/ estre filz	aux infideles et reprouvez/ estre filz
de Abraham ou Isaac selõ la chair.	de Abraham ou Isaac selon la chair.
quon peult auoir corporellemẽ tãt	qu’on peult avoir corporellemen tant
me puisse administrer. Fais quilz	me puisse administrer. Fais qu’ilz
soyẽt enseignez des plus sainctz ꝓ¬	soyent enseignez des plus sainctz pro¬
che de Iesus/ ⁊ quilz retiẽnent ⁊ en¬	che de Jesus/ et qu’ilz retiennent et en¬
cent toutes uertuz ⁊ miracles/ ayẽt	cent toutes vertuz et miracles/ ayent
toute apparẽce de sainctete/ tout ny	toute apparence de sainctete/ tout n’y
sur sõ frere le receuãt amiablemẽt/	sur son frere le recevant amiablement/
de Iudas grand apostre preschant	de Judas grand apostre preschant
ce quil auoit apprins de Iesus/ fai	ce qu’il avoit apprins de Jesus/ fai¬
tout nest rien. Et pourtãt ceulx	tout n’est rien. Et pourtant ceulx
qui ne sont pas des esleuz serõt reie	qui ne sont pas des esleuz seront reje¬
ctez/ en quoy le mõde est grãdemẽt	ctez/ en quoy le monde est grandement
donnance de Dieu inestimable/ iu¬	donnance de Dieu inestimable/ ju¬
miracles/ ⁊ autres choses/ auant le	miracles/ et autres choses/ avant le
tẽps que nostre Seigñr uiẽne. Car	temps que nostre Seigneur vienne. Car
nest point sainct. Ie laisse les mira	n’est point sainct. Je laisse les mira¬
aussi faictz par les reprouuez. Et	aussi faictz par les reprouvez. Et
ceulx que Dieu a ayme grãdemẽt	ceulx que Dieu a ayme grandement
baptiste) nõt faict aucũs miracles.	baptiste) n’ont faict aucuns miracles.
Dieu/ ⁊ nõ aux creatures/ ceremo¬	Dieu/ et non aux creatures/ ceremo¬
nies/ sacremẽtz: ou autre chose que	nies/ sacrementz: ou autre chose que
sauue ⁊ dõne uie ainsi qͥl a dispose/	sauve et donne vie ainsi qu’il a dispose/
soit accõplie ou en uie/ ou en mort.	soit accomplie ou en vie/ ou en mort.
Mais cecy ne peuuẽt uouloir q̃	Mais cecy ne peuvent vouloir que
leur pere estre faicte.	leur pere estre faicte.
loccasion uient/ ⁊ que nostre Seigͬ	l’occasion vient/ et que nostre Seigneur
oeuure en eulx) se mõstrẽt estre des	oeuvre en eulx) se monstrent estre des
sie/ papelardise/ barbotterie/ distin¬	sie/ papelardise/ barbotterie/ distin¬
lementz/ ou de lieux? En cecy ne se	lementz/ ou de lieux? En cecy ne se
declaire lesperit de Dieu/ leq̃l tire	declaire l’esperit de Dieu/ lequel tire
⁊ hõnore Dieu/ mettãt sa fiance en	et honnore Dieu/ mettant sa fiance en
rite enuers le prochain: auq̃l il sert	rite envers le prochain: auquel il sert
⁊ ayde pour lhonneur de Dieu/ en	et ayde pour l’honneur de Dieu/ en
Dieu. Lequel en soymesme na nul	Dieu. Lequel en soymesme n’a nul
de boire/ ne de mãger/ ne de maisõ/	de boire/ ne de manger/ ne de maison/
ne de robbe: mais en nostre ꝓchain	ne de robbe: mais en nostre prochain
nous luy faisons/ nous le faisõs a	nous luy faisons/ nous le faisons a
du iugement: Iay eu faim/ ⁊ uous	du jugement: J’ay eu faim/ et vous
dõne a boire. Iay este sans logis/ ⁊	donne a boire. J’ay este sans logis/ et
mauez receu auec uous: nud/ ⁊ ma	m’avez receu avec vous: nud/ et m’a¬
en prison/ ⁊ estes uenu a moy. Par	en prison/ et estes venu a moy. Par
cecy donnãt a entendre q̃ toutes les	cecy donnant a entendre que toutes les
nostre frere/ luy deuõs secourir. Car	nostre frere/ luy devons secourir. Car
enuoye pour leur ayder (cest ausq̃lz	envoye pour leur ayder (c’est ausquelz
nous pouuõs biẽ faire) pour uray	nous pouvons bien faire) pour vray
Congnoys ⁊ apprẽdz par cecy q̃l	Congnoys et apprendz par cecy quel
possede du tout ceulx qͥ ont des en¬	possede du tout ceulx qui ont des en¬
fans en necessite ⁊ paourete/ quand	fans en necessite et paovrete/ quand
aux pardõs/ questeurs/ prebstres/	aux pardons/ questeurs/ prebstres/
les paoures qͥ ne peuuẽt trauailler/	les paovres qui ne peuvent travailler/
mourantz de faim/ de soif/ ⁊ froidu	mourantz de faim/ de soif/ et froidu¬
nẽt/ ⁊ fõt grosses fondatiõs/ obitz/	nent/ et font grosses fondations/ obitz/
ges/ conuẽtz/ cloistres/ nourrissãtz	ges/ conventz/ cloistres/ nourrissantz
oyseux/ sains/ ⁊ en bon point ceulx	oyseux/ sains/ et en bon point ceulx
cõe sont ces besaciers/ ⁊ autres poͬ¬	come sont ces besaciers/ et autres pour¬
ont a leur porte leur uoysin mala¬	ont a leur porte leur voysin mala¬
de/ ⁊ tant de gẽs desolez (ausquelz	de/ et tant de gens desolez (ausquelz
⁊ les laissantz courẽt ca ⁊ la/ de lieu	et les laissantz courent ca et la/ de lieu
mis a leurs fantasies/ laissãtz ce q̃	mis a leurs fantasies/ laissantz ce que
Dieu cõmande. Entẽdez/ Dieu	Dieu commande. Entendez/ Dieu
ce quil a cõmande. Uous rẽdrez cõ¬	ce qu’il a commande. Vous rendrez com¬
tout. Car riẽ nest a uous/ Dieu les	tout. Car rien n’est a vous/ Dieu les
a mis en uoz mains pour accõplir	a mis en voz mains pour accomplir
nostre Seigͬ ne dit pas/ iestoye en	nostre Seigneur ne dit pas/ j’estoye en
me ou a saĩct Iacques/ ⁊ uoꝰ estes	me ou a sainct Jacques/ et vous estes
uenuz a moy: mais malade ⁊ en pri	venuz a moy: mais malade et en pri¬
dõne/ pour secourir a uoz paoures	donne/ pour secourir a voz paovres
des/ prisonniers/ ⁊ indigẽs: la ferez	des/ prisonniers/ et indigens: la ferez
uous les oeuures que Dieu demã	vous les oeuvres que Dieu deman¬
ne pleniere remission de peine et de	ne pleniere remission de peine et de
de soymesme par nostre Seigneur	de soymesme par nostre Seigneur
Iesus.	Jesus.
laq̃lle ilz lirõt silz ueulẽt/ se faisãtz	laquelle ilz liront s’ilz veulent/ se faisantz
ilz deffendent la saincte escripture.	ilz deffendent la saincte escripture.
Sachẽt toutesfoys (silz ne font pe	Sachent toutesfoys (s’ilz ne font pe¬
tenãt les attend a misericorde/ fera	tenant les attend a misericorde/ fera
font en contẽnant sa saincte parol¬	font en contennant sa saincte parol¬
le/ ⁊ mettant a mort ses seruiteurs	le/ et mettant a mort ses serviteurs
quilz ne pẽsent descẽdront auec les	qu’ilz ne pensent descendront avec les
les iustes/ quilz traictent ainsi mal	les justes/ qu’ilz traictent ainsi mal
iront en despit de eulx auec leur roy	iront en despit de eulx avec leur roy
tribulations/ posseder la gloire/ et	tribulations/ posseder la gloire/ et
¶ Cecy auons escrit affin q̃ tout	¶ Cecy avons escrit affin que tout
hõneur ⁊ gloire soit donne au seul	honneur et gloire soit donne au seul
qͥ le liront qͥlz ne soiẽt temeraires a	qui le liront qu’ilz ne soient temeraires a
la grace du pere plein de misericor¬	la grace du pere plein de misericor¬
de ⁊ son sainct esperit/ prẽnent leur	de et son sainct esperit/ prennent leur
songneusemẽt. Et autant qui le	songneusement. Et autant qui le
le/ autant le tiennẽt ⁊ approuuent	le/ autant le tiennent et approuvent
selon la reigle de foy/ sans auoir re	selon la reigle de foy/ sans avoir re¬
multitude ou grãd nõbre/ ne au pe	multitude ou grand nombre/ ne au pe¬
lopinion de la science: mais de pur	l’opinion de la science: mais de pur
oeil ⁊ simple coeur prouuẽt ce quon	oeil et simple coeur prouvent ce qu’on
Car mieulx uault auec le seul Elie	Car mieulx vault avec le seul Elie
Dieu/ que auec innumerables ido¬	Dieu/ que avec innumerables ido¬
latres uenir cõtre son sainct cõmã¬	latres venir contre son sainct comman¬
estimation si longtẽps ayent ainst	estimation si longtemps ayent ainst
loy de Dieu ne sa parolle. Il nya	loy de Dieu ne sa parolle. Il n’y a
aucune prescription cõtre icelle. Car	aucune prescription contre icelle. Car
nostre Seigneur Iesus ⁊ des siẽs.	nostre Seigneur Jesus et des siens.
⁊ espãdu par tout le mõde. Affin q̃	et espandu par tout le monde. Affin que
toute la terre adore ung seul Dieu	toute la terre adore ung seul Dieu
par nostre Seigñr Iesus/ qͥ nous	par nostre Seigneur Jesus/ qui nous
esperit. Amen.	esperit. Amen.
¶ Traicte de Purgatoire.	¶ Traicte de Purgatoire.
Ar la parolle de Dieu	Ar la parolle de Dieu
faict mẽtion dautre pur	faict mention d’autre pur¬
gatoire q̃ le sang de Ie¬	gatoire que le sang de Je¬
chez ⁊ iniqͥtez du mõde sõt purgez.	chez et iniquitez du monde sont purgez.
parle en lescripture saincte (selõ la¬	parle en l’escripture saincte (selon la¬
quelle on doit esprouuer les espe¬	quelle on doit esprouver les espe¬
cõment aucuns qͥ se disent Theolo	comment aucuns qui se disent Theolo¬
raires ⁊ hardis/ de enseigner autre	raires et hardis/ de enseigner autre
purgation/ que par le sang de Iesu	purgation/ que par le sang de Jesu¬
ueu dentendemẽt de croire a telz do	veu d’entendement de croire a telz do¬
iugemẽt de Dieu/ qͥ delaisse les sa¬	jugement de Dieu/ qui delaisse les sa¬
ges du mõde en sẽs reprouue/ affin	ges du monde en sens reprouve/ affin
Poͬ mõstrer dõc q̃ le purgatoire	Pour monstrer donc que le purgatoire
sion/ ⁊ espouuantemẽt/ dõnant ter	sion/ et espouvantement/ donnant ter¬
reur/ crainte/ ⁊ admiratiõ aux gẽs	reur/ crainte/ et admiration aux gens
re a memoire aucuns passages de	re a memoire aucuns passages de
tion dicelle.	tion d’icelle.
Premieremẽt/ il est escrit en S.	Premierement/ il est escrit en Sainct
ra ⁊ sera baptize/ il sera sauue: mais	ra et sera baptize/ il sera sauve: mais
Par ces parolles il appert par q̃lle	Par ces parolles il appert par quelle
uoye la dãnation nous est donnee:	voye la damnation nous est donnee:
q̃lle uoye salut noꝰ est octroye: asca	quelle voye salut nous est octroye: asca¬
mourrons fideles ou infideles. Si	mourrons fideles ou infideles. Si
nous mourõs en la foy/ noꝰ sõmes	nous mourons en la foy/ nous sommes
sauue. Si nous mourõs infideles/	sauve. Si nous mourons infideles/
dict/ qui ne croyra/ il sera cõdemne.	dict/ qui ne croyra/ il sera condemne.
Secondemẽt il est dict par sainct	Secondement il est dict par sainct
qͥl a dõne son seul filz: affin q̃ tout	qu’il a donne son seul filz: affin que tout
mais quil ayt la uie eternelle. Car	mais qu’il ayt la vie eternelle. Car
Dieu na poĩt enuoye sõ filz au mõ	Dieu n’a point envoye son filz au mon¬
q̃ le monde soit sauue par luy. Qui	que le monde soit sauve par luy. Qui
qͥ ne croit point/ il est desia iuge: car	qui ne croit point/ il est desja juge: car
il ne croit point au nom du seul filz	il ne croit point au nom du seul filz
nous a dõne son seul filz: affin q̃ ce¬	nous a donne son seul filz: affin que ce¬
nelle. En apres que la uie eternelle	nelle. En apres que la vie eternelle
ensuyt le croyant. Or ne seroit elle	ensuyt le croyant. Or ne seroit elle
iuge destre mis au feu de purgatoi¬	juge d’estre mis au feu de purgatoi¬
tout ung. Dauãtage uous con	tout ung. D’avantage vous con¬
gnoissez le monde estre sauue par	gnoissez le monde estre sauve par
soit sans peine: ⁊ celuy qui croit en	soit sans peine: et celuy qui croit en
en purgatoire il seroit iuge y aller/	en purgatoire il seroit juge y aller/
ce que ne peult estre le croyant. Car	ce que ne peult estre le croyant. Car
demnation a ceulx qui sont en Ie¬	demnation a ceulx qui sont en Je¬
re par S. Iehan ou il a dict: En ue	re par Sainct Jehan ou il a dict: En ve¬
rite/ en uerite ie uous dis/ qͥ oyt ma	rite/ en verite je vous dis/ qui oyt ma
il a la uie eternelle/ ⁊ ne uiẽt point	il a la vie eternelle/ et ne vient point
mort a la uie. Et silz uouloiẽt	mort a la vie. Et s’ilz vouloient
dire q̃ aller en purgatoire/ nest poĩt	dire que aller en purgatoire/ n’est point
a leurs traditiõs humaines/ qͥ disẽt	a leurs traditions humaines/ qui disent
tel/ estre adiugee sept ans au feu de	tel/ estre adjugee sept ans au feu de
purgatoire. Qui est ung grand er¬	purgatoire. Qui est ung grand er¬
affermer telles choses sans q̃lq̃ fon	affermer telles choses sans quelque fon¬
trouue point qͥ soit faict mẽtion de	trouve point qui soit faict mention de
sept ans/ ou de dix/ ou de douze: ne	sept ans/ ou de dix/ ou de douze: ne
repos/ ⁊ de torment. Cõme assez est	repos/ et de torment. Comme assez est
du mauuais riche/ ⁊ du Lazare.	du mauvais riche/ et du Lazare.
Itẽ le brigãt qͥ fut crucifie pres	Item le brigant qui fut crucifie pres
toire pour faire penitẽce de ses pe¬	toire pour faire penitence de ses pe¬
dhuy en paradis auec moy. Ou est	d’huy en paradis avec moy. Ou est
donc sa purgation? nest ce pas par	donc sa purgation? n’est ce pas par
regeneration quil a espãdu sur noꝰ	regeneration qu’il a espandu sur nous
rifie les coeurs?	rifie les coeurs?
Oultre ie leur demãde: si le pur¬	Oultre je leur demande: si le pur¬
carnation. De dire qͥl ayt este seule	carnation. De dire qu’il ayt este seule¬
malheureusement parle/ ⁊ ne seroit	malheureusement parle/ et ne seroit
point Iesuchrist uray redempteur:	point Jesuchrist vray redempteur:
Si on respõd qͥl estoit des le cõmẽ¬	Si on respond qu’il estoit des le commen¬
testamẽt le prouuerõt ilz? Ou sont	testament le prouveront ilz? Ou sont
escriptz en Moyse/ ou aux prophe¬	escriptz en Moyse/ ou aux prophe¬
der a ceulx qͥ estoiẽt en ceste peine?	der a ceulx qui estoient en ceste peine?
de sacrifices bruslez/ oblatiõs/ laue	de sacrifices bruslez/ oblations/ lave¬
mens/ ⁊ expiatiõs/ pour les pechez	mens/ et expiations/ pour les pechez
seul mot du purgatoire/ ny ð la ma	seul mot du purgatoire/ n’y dict la ma¬
ains il deffend aux sacrificateurs	ains il deffend aux sacrificateurs
de nestre poĩt souillez sur les corps	de n’estre point souillez sur les corps
mort de leͬs citoyẽs. Ce q̃ S. Paul	mort de leurs citoyens. Ce que Sainct Paul
saloniẽs. Parquoy cest chose incer¬	saloniens. Parquoy c’est chose incer¬
taine de determiner quil y ayt ung	taine de determiner qu’il y ayt ung
riẽ en la saincte escriture: ains icelle	rien en la saincte escriture: ains icelle
pert en ce passage de Lapocalipse:	pert en ce passage de L’apocalipse:
Biẽheureux sont les mortz/ qͥ sont	Bienheureux sont les mortz/ qui sont
Maintenãt ie demãde si celuy qͥ	Maintenant je demande si celuy qui
non. Si meurt en nostre Seigñr/ il	non. Si meurt en nostre Seigneur/ il
est biẽheureux/ cõme il appert par	est bienheureux/ comme il appert par
Seigñr/ il est malheureux uerita¬	Seigneur/ il est malheureux verita¬
Mais quelque petit sophistereau	Mais quelque petit sophistereau
me diroit: Distinguo/ quãtum ad pe¬	me diroit: Distinguo/ quantum ad pe¬
cedo: Cestadire/ Dieu pardonne la	cedo: C’est a dire/ Dieu pardonne la
paoure sophiste/ ou as tu trouue q̃	paovre sophiste/ ou as tu trouve que
Dieu pardonne lung sans lautre.	Dieu pardonne l’ung sans l’autre.
ctes/ il nous pardõne tout/ ou rien/	ctes/ il nous pardonne tout/ ou rien/
nous tesmoingne Ezechiel/ disant:	nous tesmoingne Ezechiel/ disant:
En quelcõque heure q̃ le pecheur ge	En quelconque heure que le pecheur ge¬
tous ses pechez/ S. Iehã dict aussi:	tous ses pechez/ Sainct Jehan dict aussi:
il est fidele ⁊ iuste pour nous pardõ	il est fidele et juste pour nous pardon¬
ner/ ⁊ nous nettoyer de toute iniqͥ¬	ner/ et nous nettoyer de toute iniqui¬
nous auõs cõpaignie auec luy/ ⁊ le	nous avons compaignie avec luy/ et le
toye de tout peche: car il sied a la	toye de tout peche: car il sied a la
dextre de Dieu faisãt la purgatiõ	dextre de Dieu faisant la purgation
le oblation a rendu parfaictz eter¬	le oblation a rendu parfaictz eter¬
En apres dit le Psalmiste: Mais	En apres dit le Psalmiste: Mais
apres q̃ ie tay dõne a cõgnoistre mõ	apres que je t’ay donne a congnoistre mon
me: lors que iay dit (en me accusant	me: lors que j’ay dit (en me accusant
sion au Seigͬ/ incõtinent tu as re¬	sion au Seigneur/ incontinent tu as re¬
mis le crime de mon peche. Si donc	mis le crime de mon peche. Si donc
pechez quãd affectueusemẽt de ce le	pechez quand affectueusement de ce le
moleste poͬ iceulx/ ueu qͥlz noꝰ sõt	moleste pour iceulx/ veu qu’ilz nous sont
effacez par la foy/ q̃ nous auons en	effacez par la foy/ que nous avons en
quelle est parfaicte/ ou ĩparfaicte.	quelle est parfaicte/ ou imparfaicte.
riẽ poͬ la parfaire: car se seroit blas¬	rien pour la parfaire: car se seroit blas¬
phemer la passion de Christ: ainsi q̃	phemer la passion de Christ: ainsi que
qͥlz ueulẽt par leurs oeuures satis¬	qu’ilz veulent par leurs oeuvres satis¬
purgatoire. Silz ueullẽt dire: Da¬	purgatoire. S’ilz veullent dire: Da¬
uid a peche: puis sõ peche luy a este	vid a peche: puis son peche luy a este
point quant a la peine: pource quil	point quant a la peine: pour ce qu’il
