¶ Sũmaire/ ⁊ briefue	¶ Summaire/ et briefve
declaration daucuns lieux	declaration d’aucuns lieux
chascun Chrestien/	chascun Chrestien/
cõfiãce en	confiance en
Dieu/	Dieu/
prochain.	prochain.
gatoire nouuelle¬	gatoire nouvelle¬
mẽt adiouste	ment adjouste
fin.	fin.
¶ En mansuetude ⁊ doulceur rece	¶ En mansuetude et doulceur rece¬
uez la parolle de Dieu/ laquelle est	vez la parolle de Dieu/ laquelle est
S. Iehan au douziesme.	Sainct Jehan au douziesme.
receoit mes parolles/ il a qui le iu¬	receoit mes parolles/ il a qui le ju¬
ge. Ma parolle laquelle iay parle/	ge. Ma parolle laquelle j’ay parle/
Chrestiens ne uous arrestez au	Chrestiens ne vous arrestez au
rõt de ce liure: car ilz sont aueugles	ront de ce livre: car ilz sont aveugles
⁊ conducteurs daueugles.	et conducteurs d’aveugles.
Seigneur/ ⁊ ont desir de	Seigneur/ et ont desir de
uerite:	verite:
Salut.	Salut.
N ce temps auquel il	N ce temps auquel il
reueler sa saincte clarte	reveler sa saincte clarte
⁊ lumiere sur ceulx qui	et lumiere sur ceulx qui
plus grãdes que celles quon attou	plus grandes que celles qu’on attou¬
sieurs sont qui ne peuuent croire	sieurs sont qui ne peuvent croire
auoir este en telles tenebres/ neant¬	avoir este en telles tenebres/ neant¬
fort a dire sus lestat de ceulx qui	fort a dire sus l’estat de ceulx qui
et quilz nont faict leur office deu¬	et qu’ilz n’ont faict leur office deu¬
ment. Mais de congnoistre la prin	ment. Mais de congnoistre la prin¬
a cause de la grosse cecite/ trouble/ ⁊	a cause de la grosse cecite/ trouble/ et
este enuirõne ⁊ enueloppe/ ne po¬	este environne et enveloppe/ ne po¬
uans entẽdre ne croire quil ayt este	vans entendre ne croire qu’il ayt este
ge et gaste: tellement quil ny soit	ge et gaste: tellement qu’il n’y soit
estre: ⁊ quil ne pourroit estre que en	estre: et qu’il ne pourroit estre que en
si long tẽps il ny eust quelcun con¬	si long temps il n’y eust quelcun con¬
sance de uerite: ueu que tant de mi	sance de verite: veu que tant de mi¬
temples ont este esleuez/ tant de re¬	temples ont este eslevez/ tant de re¬
ligions fondees ou innumerables	ligions fondees ou innumerables
que sainctz. Car ceulx qui ont este	que sainctz. Car ceulx qui ont este
tousiours tache les auancer ⁊ hon¬	tousjours tache les avancer et hon¬
norer.	norer.
uerite: ⁊ ne uous fondez en uoz en	verite: et ne vous fondez en voz en¬
ce: mais en Dieu/ duquel le propos	ce: mais en Dieu/ duquel le propos
est immuable/ ⁊ ce quil dit ne peult	est immuable/ et ce qu’il dit ne peult
ce quil a predict par ses seruiteurs	ce qu’il a predict par ses serviteurs
uous trouuerez q̃ tout deuoit adue	vous trouverez que tout devoit adve¬
nir ainst quil a este/ ⁊ telle seductiõ	nir ainst qu’il a este/ et telle seduction
gaste ⁊ destruit plus quon ne pour¬	gaste et destruit plus qu’on ne pour¬
il uient que uous ne pouez croire	il vient que vous ne povez croire
que si grãde tromperie ayt obtenu	que si grande tromperie ayt obtenu
escripture plus en congnoistrez par	escripture plus en congnoistrez par
nez uous garde en la lisant/ que ne	nez vous garde en la lisant/ que ne
la tirez a uostre sens/ la faisant ser	la tirez a vostre sens/ la faisant ser¬
pasture des brebis/ la parolle de	pasture des brebis/ la parolle de
re/ ⁊ marchant sus aux piedz/ ou	re/ et marchant sus aux piedz/ ou
que par icelle uous traictez cruelle	que par icelle vous traictez cruelle¬
frappant de uoz cornes: Mais en	frappant de voz cornes: Mais en
donner honneur et gloire au seul	donner honneur et gloire au seul
Dieu/ sãs se arrester a aucune crea	Dieu/ sans se arrester a aucune crea¬
en Dieu/ sans estimer autre chose	en Dieu/ sans estimer autre chose
a charite/ a garder amitie/ paix/ et	a charite/ a garder amitie/ paix/ et
concorde auec tous/ tant quil est en	concorde avec tous/ tant qu’il est en
ceur du sauueur/ ⁊ non point la cru	ceur du sauveur/ et non point la cru¬
chez a la destruction des uices ⁊ pe	chez a la destruction des vices et pe¬
chez/ ⁊ au salut des pecheurs en tou	chez/ et au salut des pecheurs en tou¬
ctions ameres en toute charite (ce	ctions ameres en toute charite (ce
sant ⁊ prenant tousiours de la sain	sant et prenant tousjours de la sain¬
cte escripture. Car es maladies fort	cte escripture. Car es maladies fort
aller a la uolee: mais user de bons	aller a la volee: mais user de bons
faire du salut en ce qui touche lame	faire du salut en ce qui touche l’ame
ne fault proposer que choses trescer	ne fault proposer que choses tres cer¬
pture saincte tãt seulemẽt/ laquelle	pture saincte tant seulement/ laquelle
Nul ne se espargne a ayder sõ pro¬	Nul ne se espargne a ayder son pro¬
chain. Nul aussi ne reiecte ladmoni	chain. Nul aussi ne rejecte l’admoni¬
tout soit prouue/ et quon tienne ce	tout soit prouve/ et qu’on tienne ce
mauuais. Non point ainsi quil noꝰ	mauvais. Non point ainsi qu’il nous
semble: mais comme la saincte escri	semble: mais comme la saincte escri¬
ou reiecter.	ou rejecter.
suis debteur ⁊ tenu a tous de ce que	suis debteur et tenu a tous de ce que
nostre Seigñr a mis en moy/ pour	nostre Seigneur a mis en moy/ pour
(ne uoulãt nuyre a personne: mais	(ne voulant nuyre a personne: mais
honneur ⁊ gloire au seul Dieu) a	honneur et gloire au seul Dieu) a
tous offre ⁊ presente ce que nostre	tous offre et presente ce que nostre
chascun pour lamour diceluy qui	chascun pour l’amour d’iceluy qui
seul filz treschier pour nous/ quen	seul filz tres chier pour nous/ qu’en
toute diligẽce par une ardente affe	toute diligence par une ardente affe¬
quelle gist lhonneur de Dieu/ on	quelle gist l’honneur de Dieu/ on
selon la loy de Dieu/ selon le iuge¬	selon la loy de Dieu/ selon le juge¬
ment de lescripture. Priãt le pere	ment de l’escripture. Priant le pere
et soit son bon plaisir plus claire¬	et soit son bon plaisir plus claire¬
sance au paoure monde/ chassant	sance au paovre monde/ chassant
toutes tenebres derreur par le so¬	toutes tenebres d’erreur par le so¬
sus/ uraye lumiere ⁊ uerite/ illumi	sus/ vraye lumiere et verite/ illumi¬
rans par son sainct esperit: telle¬	rans par son sainct esperit: telle¬
mẽt que de toutes partz du monde	ment que de toutes partz du monde
son sainct tabernacle en son propi¬	son sainct tabernacle en son propi¬
pteur Iesus/ auquel ⁊ par le¬	pteur Jesus/ auquel et par le¬
quel il soit seruy/ adore/	quel il soit servy/ adore/
saincte uolunte:	saincte volunte:
mouue¬	mouve¬
ment	ment
esperit.	esperit.
¶ De Dieu Chapitre.i.	¶ De Dieu Chapitre.i.
D	D¬
⁊ sagesse infinie/ sans cõ	et sagesse infinie/ sans com¬
rite immuable. Ce que	rite immuable. Ce que
bien on entend par la creation du	bien on entend par la creation du
qui ne porte proffit. Et cõbien quil	qui ne porte proffit. Et combien qu’il
trariete/ neãtmoins par la puissan	trariete/ neantmoins par la puissan¬
ce de Dieu est conserue/ ainsi que	ce de Dieu est conserve/ ainsi que
bien ordõne. Cecy nous monstre la	bien ordonne. Cecy nous monstre la
Dieu est si bon/ quil nous a forme	Dieu est si bon/ qu’il nous a forme
a sa semblance nous donnãt la sei¬	a sa semblance nous donnant la sei¬
quelle perdue par desobeissance et	quelle perdue par desobeissance et
la grande bonte de Dieu/ lequel a	la grande bonte de Dieu/ lequel a
tant ayme le mõde quil a dõne son	tant ayme le monde qu’il a donne son
ce du pere estant en luy a destruict	ce du pere estant en luy a destruict
gesse destruisant le peche ꝑ le corps	gesse destruisant le peche par le corps
semblable a peche/ donnãt ⁊ restau	semblable a peche/ donnant et restau¬
ceulx qͥ estoiẽt mortz par inobediẽ¬	ceulx qui estoient mortz par inobedien¬
immuable de Dieu fust accomply:	immuable de Dieu fust accomply:
⁊ que ceulx qui auant le commence	et que ceulx qui avant le commence¬
nez a uie en eussent iouyssãce ⁊ pos	nez a vie en eussent jouyssance et pos¬
escripte au coeur engẽdre telle ꝯfiã	escripte au coeur engendre telle confian¬
ce en la grãde bõte de Dieu/ q̃ rien	ce en la grande bonte de Dieu/ que rien
Car on uit a luy en le sentant ⁊ cõ¬	Car on vit a luy en le sentant et con¬
eternelle congnoistre le seul uray	eternelle congnoistre le seul vray
dieu/ ⁊ celuy qͥl a ẽuoye Iesuchrist.	dieu/ et celuy qu’il a envoye Jesuchrist.
L	L’
pouuant rien/ fol ⁊ teme	pouvant rien/ fol et teme¬
raire/ ambitieux/ plein de	raire/ ambitieux/ plein de
constant/ uariable/ ne pensant que	constant/ variable/ ne pensant que
ceu/ en tout ⁊ par tout cerche soy	ceu/ en tout et par tout cerche soy¬
mesme/ nestimãt q̃ soy ⁊ son prouf¬	mesme/ n’estimant que soy et son prouf¬
ses oeuures/ puissances ⁊ uertus/	ses oeuvres/ puissances et vertus/
plus est aspre ⁊ songneux de gar¬	plus est aspre et songneux de gar¬
der ses inuentions/ loix ⁊ ordonnã	der ses inventions/ loix et ordonnan¬
porter destre humilie/ deshonnore ⁊	porter d’estre humilie/ deshonnore et
Dieu/ sus sa saincte parolle/ loy/ ⁊	Dieu/ sus sa saincte parolle/ loy/ et
cõmandement. Et dautãt est	commandement. Et d’autant est
dapparẽce de iustice ⁊ sainctete. Et	d’apparence de justice et sainctete. Et
reux ⁊ menteur: cõme racine pour¬	reux et menteur: comme racine pour¬
rie ⁊ mauuais arbre ne peult porter	rie et mauvais arbre ne peult porter
rompu en luy. Pourtant que mort	rompu en luy. Pourtant que mort
ne peult fructifier que a la mort et	ne peult fructifier que a la mort et
dãnation/ ayant toutes cogitatiõs	damnation/ ayant toutes cogitations
ction des pẽsees de son coeur est tãt	ction des pensees de son coeur est tant
il est chair/ ⁊ ce qui uiẽt de son coeur	il est chair/ et ce qui vient de son coeur
est mal/ ⁊ toute affection de chair.	est mal/ et toute affection de chair.
I	J¬
Dieu/ le bras/ puissance/	Dieu/ le bras/ puissance/
parolle/ ⁊ sapiẽce du pere.	parolle/ et sapience du pere.
a esleu son sainct tẽple/ son habita¬	a esleu son sainct temple/ son habita¬
sainctz/ le propitiatoire ou sõt tous	sainctz/ le propitiatoire ou sont tous
les thresors de sapience ⁊ sagesse/ ⁊	les thresors de sapience et sagesse/ et
cõme en lombre ⁊ figure/ mais cõ¬	comme en l’ombre et figure/ mais com¬
sommee et parfaictement accõplie	sommee et parfaictement accomplie
toute loeuure de Dieu. Car par luy	toute l’oeuvre de Dieu. Car par luy
choses/ tant au ciel que en la terre:	choses/ tant au ciel que en la terre:
sance/ uertu/ sagesse/ grace ⁊ iustice	sance/ vertu/ sagesse/ grace et justice
sont en luy. Lequel faict obeissãt	sont en luy. Lequel faict obeissant
sans semence dhõme/ faict subiect	sans semence d’homme/ faict subject
re/ ne sa uolunte: mais celle du pe¬	re/ ne sa volunte: mais celle du pe¬
re/ ne parlant ⁊ ne faisant rien de	re/ ne parlant et ne faisant rien de
lequel estoit en luy/ reconciliant le	lequel estoit en luy/ reconciliant le
Tant se est humilie ⁊ abbaisse	Tant se est humilie et abbaisse
quil est mort pour nous/ luy iuste ⁊	qu’il est mort pour nous/ luy juste et
offrãt son corps ⁊ son sang pour la	offrant son corps et son sang pour la
les par ceste mort ⁊ sacrifice/ et par	les par ceste mort et sacrifice/ et par
ce beau don de sõ filz/ le pere ueult	ce beau don de son filz/ le pere veult
⁊ uie/ ⁊ que pleinement elles sont	et vie/ et que pleinement elles sont
tez. Et que le pere pour lamour de	tez. Et que le pere pour l’amour de
soy mesme/ et non pas poͬ lamour	soy mesme/ et non pas pour l’amour
tes/ ⁊ iustices (qui ne sont que abo¬	tes/ et justices (qui ne sont que abo¬
uiuifie/ nous prenãt pour ses filz ⁊	vivifie/ nous prenant pour ses filz et
heritiers/ heritiers auec Iesuchrist/	heritiers/ heritiers avec Jesuchrist/
ceulx qui ont uraye foy en luy/ et	ceulx qui ont vraye foy en luy/ et
de Iesus. Par la uertu diuine qͥ	de Jesus. Par la vertu divine qui
habite au chef/ toute puissance con¬	habite au chef/ toute puissance con¬
faicte ⁊ ĩmortelle/ nostre mort abo¬	faicte et immortelle/ nostre mort abo¬
⁊ innocẽce infinie qui est en luy/ tou	et innocence infinie qui est en luy/ tou¬
te nostre mauuaistie/ iniquite/ ⁊ or¬	te nostre mauvistie/ iniquite/ et or¬
de puissance nous sommes reparez	de puissance nous sommes reparez
fusmes auant le peche de Adã/ au	fusmes avant le peche de Adam/ au
paradis: non point qui est terrien/	paradis: non point qui est terrien/
corporelle/ corruptible/ ⁊ quõ peult	corporelle/ corruptible/ et qu’on peult
ptiõ/ et quon ne perdra iamais.	ption/ et qu’on ne perdra jamais.
Qui cõgnoist ⁊ entend cecy par	Qui congnoist et entend cecy par
la uie eternelle/ ⁊ plus ne se arreste	la vie eternelle/ et plus ne se arreste
nes/ ayant congnoissance du pere	nes/ ayant congnoissance du pere
par le filz: auquel il cõgnoist ⁊ en¬	par le filz: auquel il congnoist et en¬
infinie misericorde.	infinie misericorde.
L	L¬
A loy de Dieu uraye rei¬	A loy de Dieu vraye rei¬
aux hommes leurs fau¬	aux hommes leurs fau¬
du chemin auquel ilz doiuẽt chemi	du chemin auquel ilz doivent chemi¬
ner/ declairãt ꝑ menaces les grãdz	ner/ declairant par menaces les grandz
gresseͬs/ engẽdrãt horreur ⁊ crain¬	gresseurs/ engendrant horreur et crain¬
pource quelle trouue tous hõmes	pour ce qu’elle trouve tous hommes
charnelz ⁊ destituez de lesperit de	charnelz et destituez de l’esperit de
piscence/ par occasion multipliant	piscence/ par occasion multipliant
Et dela uient que tous ceulx qui	Et dela vient que tous ceulx qui
sont soubz la loy/ sont en maledi¬	sont soubz la loy/ sont en maledi¬
faire ce que la loy demãde. Car elle	faire ce que la loy demande. Car elle
mais par foy. A cause dequoy	mais par foy. A cause dequoy
elle dõne a entendre quon doit cer¬	elle donne a entendre qu’on doit cer¬
loy/ iustifiant tous ceulx qͥ croyent	loy/ justifiant tous ceulx qui croyent
ter lire ⁊ indignation de Dieu qui	ter lire et indignation de Dieu qui
noꝰ est mõstree par la loy/ laquel¬	nous est monstree par la loy/ laquel¬
Dequoy sommes deliurez par Ie¬	Dequoy sommes delivrez par Je¬
croyõs quil a porte la malediction	croyons qu’il a porte la malediction
pour nous.	pour nous.
L	L’
puissãce de Dieu en salut	puissance de Dieu en salut
a tout croyant/ la consola	a tout croyant/ la consola¬
ce des captifz/ la uie des mortz et	ce des captifz/ la vie des mortz et
tout sentement.	tout sentement.
Qui ne sesiouyroit en ouyãt son	Qui ne s’esjouyroit en ouyant son
en la pleine puissance duq̃l il estoit)	en la pleine puissance duquel il estoit)
dãnation ineuitable luy estre tour¬	damnation inevitable luy estre tour¬
nee en uie ⁊ salut eternel? enfer au	nee en vie et salut eternel? enfer au
cõpaignie des diables/ en la bour¬	compaignie des diables/ en la bour¬
enfãs de Dieu? Ce qui nous est an	enfans de Dieu? Ce qui nous est an¬
nonce par la mort de Iesus/ qͥ par	nonce par la mort de Jesus/ qui par
a sauuez/ nous ostant la crainte ser	a sauvez/ nous ostant la crainte ser¬
quil ny a poĩt de dãnation a ceulx	qu’il n’y a point de damnation a ceulx
qui sont en Iesus. Car deliurez de	qui sont en Jesus. Car delivrez de
laquelle ilz estoient detenus par la	laquelle ilz estoient detenus par la
ilz sont faictz filz par foy qͥlz ont/	ilz sont faictz filz par foy qu’ilz ont/
croyãs parfaictemẽt tout leur estre	croyans parfaictement tout leur estre
triumphe de noz ennemis. Et	triumphe de noz ennemis. Et
par luy tout est nostre/ ainsi quil	par luy tout est nostre/ ainsi qu’il
nous est annõce par ses bõnes nou	nous est annonce par ses bonnes nou¬
a tout restaure ⁊ dõne/ ⁊ encore da¬	a tout restaure et donne/ et encore da¬
Et pourtant ayans pleine foy/	Et pourtant ayans pleine foy/
noꝰ armõs de sa iustice cõtre nostre	nous armons de sa justice contre nostre
son innocẽce cõtre nostre iniqͥte. Et	son innocence contre nostre iniquite. Et
ses de Dieu/ et si grãd bien que ia¬	ses de Dieu/ et si grand bien que ja¬
mais oeil ne ueit/ ne aureille ne	mais oeil ne veit/ ne aureille ne
grand ce q̃ Dieu nous a promis.	grand ce que Dieu nous a promis.
P	P¬
Eche/ est nature corrõpue	Eche/ est nature corrompue
aymant soymesme/ repu¬	aymant soymesme/ repu¬
la hayant/ aymant les choses char	la hayant/ aymant les choses char¬
nelles/ mesprisant les spirituelles/	nelles/ mesprisant les spirituelles/
toute ignorãce/ fructifiãt a mort.	toute ignorance/ fructifiant a mort.
mauuaise/ quelle ne peult que mal.	mauvaise/ qu’elle ne peult que mal.
Et dautant que la droicte uoye et	Et d’autant que la droicte voye et
nifeste/ dautant plus il la reiecte et	nifeste/ d’autant plus il la rejecte et
destruict par la mort de Iesus/ il	destruict par la mort de Jesus/ il
dit le bien estre mal/ ⁊ le mal bien/	dit le bien estre mal/ et le mal bien/
lumiere/ blasphemãt le sainct espe¬	lumiere/ blasphemant le sainct espe¬
soy innocence/ ⁊ se eleuant contre	soy innocence/ et se elevant contre
Dieu ⁊ son esperit/ le condemnant	Dieu et son esperit/ le condemnant
⁊ honneur.	et honneur.
I	J¬
Ustice/ est la uraye ima¬	Ustice/ est la vraye ima¬
regeneratiõ qui est faicte	regeneration qui est faicte
receue par foy/ ⁊ escrite au coeͬ des	receue par foy/ et escrite au coeur des
filz de Dieu. Par laquelle lhom	filz de Dieu. Par laquelle l’hom¬
⁊ toutes choses/ ayme tant seule¬	et toutes choses/ ayme tant seule¬
cte loy/ tire hors de toutes choses	cte loy/ tire hors de toutes choses
terriẽnes/ brusle apres les celestiel¬	terriennes/ brusle apres les celestiel¬
de Dieu/ il porte fruict de uie sa¬	de Dieu/ il porte fruict de vie sa¬
demner ⁊ reiecter le mal/ donnãt a	demner et rejecter le mal/ donnant a
Dieu tout hõneur ⁊ gloire luy at¬	Dieu tout honneur et gloire luy at¬
ctant tout autre ayde ⁊ confiance/	ctant tout autre ayde et confiance/
dement de Dieu ne contient.	dement de Dieu ne contient.
¶ De la chair ⁊ uieil homme.	¶ De la chair et vieil homme.
C	C¬
adire tout homme/ qui de	a dire tout homme/ qui de
soymesme est serf ⁊ captif	soymesme est serf et captif
re/ ueult/ entend/ scait/ cõgnoit/ iu¬	re/ veult/ entend/ scait/ congnoit/ ju¬
uolunte/ sagesse/ prudence/ iuge¬	volunte/ sagesse/ prudence/ juge¬
ment/ est oeuure charnelle.	ment/ est oeuvre charnelle.
ction de peche sõt une mesme chose.	ction de peche sont une mesme chose.
mort: car leur fruict nest q̃ hayne/	mort: car leur fruict n’est que hayne/
meurtre/ ẽuie/ paillardise/ larrecin/	meurtre/ envie/ paillardise/ larrecin/
ses pensees ⁊ cogitations: bref/ con	ses pensees et cogitations: bref/ con¬
Et maintenant uient tout clai¬	Et maintenant vient tout clai¬
rement contre la parolle de Dieu	rement contre la parolle de Dieu
ne faict pas selon le uouloir/ esti¬	ne faict pas selon le vouloir/ esti¬
Il ny a point de Dieu/ il ny a poĩt	Il n’y a point de Dieu/ il n’y a point
de iustice en hault/ Dieu na point	de justice en hault/ Dieu n’a point
bas: ⁊ semblables blasphemes con¬	bas: et semblables blasphemes con¬
sortent ⁊ uiennẽt de la chair. Et	sortent et viennent de la chair. Et
par autre maniere soy cõtrefaisant	par autre maniere soy contrefaisant
le zele de Dieu ⁊ desir de sõ hõneur	le zele de Dieu et desir de son honneur
son sainct nom/ ⁊ qͥl soit seruy plus	son sainct nom/ et qu’il soit servy plus
sainctement ⁊ en plus grande reue	sainctement et en plus grande reve¬
uelles manieres de faire hors de la	velles manieres de faire hors de la
reigles ⁊ institutiõs/ simulãt/ fein¬	reigles et institutions/ simulant/ fein¬
gnant/ ⁊ mentant en toute saincte¬	gnant/ et mentant en toute saincte¬
ne fault estre legier a suyure ce qui	ne fault estre legier a suyvre ce qui
uiẽt de nostre coeur cõme dautruy:	vient de nostre coeur comme d’autruy:
mais fault prouuer diligẽmẽt quel	mais fault prouver diligemment quel
tenebres se transfigure en ange de	tenebres se transfigure en ange de
sus tout la prudence de la chair.	sus tout la prudence de la chair.
Il fault donc prouuer par la sain¬	Il fault donc prouver par la sain¬
examiner toutes motions/ toꝰ pro¬	examiner toutes motions/ tous pro¬
esperit cest qui les suggere: sil est de	esperit c’est qui les suggere: s’il est de
Dieu/ ou de la chair. Quon regar¬	Dieu/ ou de la chair. Qu’on regar¬
laquelle il a este nõme Satan/ celle	laquelle il a este nomme Satan/ celle
ont uoulu faire le seruice de Dieu	ont voulu faire le service de Dieu
aux haultz lieux/ et par les boys/	aux haultz lieux/ et par les boys/
par auãt/ cõment ilz sont repris de	par avant/ comment ilz sont repris de
de chair/ laquelle cõment quil soit	de chair/ laquelle comment qu’il soit
ueult auoir la seigneurie et domi¬	veult avoir la seigneurie et domi¬
ner ⁊ disposer a son plaisir/ ⁊ auoir	ner et disposer a son plaisir/ et avoir
¶ De lesperit et nouuel	¶ De l’esperit et nouvel
homme. Chap̃.ix.	homme. Chapitre.ix.
Esperit est le mouue¬	Esperit est le mouve¬
Dieu baille a lhomme	Dieu baille a l’homme
se renouuellãt/ luy don	se renouvellant/ luy don¬
Iesus.	Jesus.
tre la chair: ⁊ iamais ny paix iusq̃	tre la chair: et jamais ny paix jusque
a ce que la chair soit morte. Il est	a ce que la chair soit morte. Il est
de Dieu/ des choses profondes de	de Dieu/ des choses profondes de
il poulse lhõme affin quil soit imi¬	il poulse l’homme affin qu’il soit imi¬
tateur de la bonte de Dieu/ fructi¬	tateur de la bonte de Dieu/ fructi¬
benignite/ compassion/ chastete/ pa	benignite/ compassion/ chastete/ pa¬
ce/ ferme esperãce en celuy qͥ a tout	ce/ ferme esperance en celuy qui a tout
faict/ auquel il a toute confiance et	faict/ auquel il a toute confiance et
temeraire/ ne presumptueux: mais	temeraire/ ne presumptueux: mais
Dieu lequel ueritable point ne se	Dieu lequel veritable point ne se
change: mais ce quil a dict il le fera/	change: mais ce qu’il a dict il le fera/
pourtant adresse lhõme/ affin quil	pourtant adresse l’homme/ affin qu’il
doibt/ ⁊ quil ne se arreste a autre q̃ a	doibt/ et qu’il ne se arreste a autre que a
Dieu/ ne prenãt autre maniere de	Dieu/ ne prenant autre maniere de
sement cõmande/ ne se arrestãt que	sement commande/ ne se arrestant que
que tout soit change ⁊ mue/ et que	que tout soit change et mue/ et que
les infideles florissent/ grãs signes	les infideles florissent/ grans signes
disent autrement que le pur cõman	disent autrement que le pur comman¬
bouge: mais quil demeure ferme en	bouge: mais qu’il demeure ferme en
la parolle/ laquelle demeure eter¬	la parolle/ laquelle demeure eter¬
quil uueille/ il donne cest hõneur a	qu’il vueille/ il donne cest honneur a
ce qui nest prouue par sa saincte pa	ce qui n’est prouve par sa saincte pa¬
rolle/ nest que uanite ⁊ mensonge.	rolle/ n’est que vanite et mensonge.
cecy par experience/ que par liure.	cecy par experience/ que par livre.
esleuz/ affin quilz desirent/ et affe¬	esleuz/ affin qu’ilz desirent/ et affe¬
ctueusemẽt prient que lesperit leur	ctueusement prient que l’esperit leur
nouueaulx hõmes/ ⁊ ayẽt cõgnois¬	nouveaulx hommes/ et ayent congnois¬
esperit/ ⁊ quilz tuẽt ⁊ destruisẽt tou	esperit/ et qu’ilz tuent et destruisent tou¬
tes les affections de la chair et du	tes les affections de la chair et du
neur ⁊ gloire diceluy qͥ peult ⁊ faict	neur et gloire d’iceluy qui peult et faict
ayans pleine fiance en luy/ laymãt	ayans pleine fiance en luy/ l’aymant
de nostre coeur. Et pour lamour de	de nostre coeur. Et pour l’amour de
nostre prochain.	nostre prochain.
et mescreance. Chap̃.x.	et mescreance. Chapitre.x.
I	I¬
mescreance/ est moins sen¬	mescreance/ est moins sen¬
quil ne cõuient/ de linfinie	qu’il ne convient/ de l’infinie
bonte/ misericorde/ sagesse ⁊ puissã	bonte/ misericorde/ sagesse et puissan¬
ne se peult fier en Dieu: mais incer	ne se peult fier en Dieu: mais incer¬
ayde ⁊ secours/ pleine de inconstan	ayde et secours/ pleine de inconstan¬
ce/ crainct ou il ny a point de matie	ce/ crainct ou il n’y a point de matie–
seurete/ sans aucun certain propos	seurete/ sans aucun certain propos
ne subiecte a toute tromperie ⁊ dece	ne subjecte a toute tromperie et dece¬
ption. Car la ou nest la lumiere de	ption. Car la ou n’est la lumiere de
la regnẽt les princes des tenebres/	la regnent les princes des tenebres/
mens en la fosse. Pour le bon che¬	mens en la fosse. Pour le bon che¬
min on prent le mauuais/ pour la	min on prent le mauvais/ pour la
mes. Pour les choses qui sont ag¬	mes. Pour les choses qui sont ag¬
donnances/ ce quil a en abomina¬	donnances/ ce qu’il a en abomina¬
tion/ ⁊ la doctrine diabolicque. Car	tion/ et la doctrine diabolicque. Car
te/ et tout ce qui faict celuy qui na	te/ et tout ce qui faict celuy qui n’a
que couleur quil ayt de sainctete et	que couleur qu’il ayt de sainctete et
de bonne oeuure.	de bonne oeuvre.
F	F¬
don de Dieu/ par laq̃lle	don de Dieu/ par laquelle
sõmes faictz filz de dieu/	sommes faictz filz de dieu/
⁊ cõgnoissance uraye de Dieu nr̃e	et congnoissance vraye de Dieu notre
⁊ sage: ⁊ q̃ pour lamour de soymes¬	et sage: et que pour l’amour de soymes¬
me il nous a esleu pour ses filz/ sau	me il nous a esleu pour ses filz/ sau¬
Iesus.	Jesus.
sainctes promesses de Dieu/ ne de	sainctes promesses de Dieu/ ne de
ce quil a parle par les siens pleins	ce qu’il a parle par les siens pleins
