¶ Sũmaire/ ⁊ briefue	¶ Summaire/ et briefve
cõmunie: mais quon layme ⁊ corri	communie: mais qu’on l’ayme et corri¬
pour lequel tous ceulx qui ne pren	pour lequel tous ceulx qui ne pren¬
nẽt le pain de action de graces auec	nent le pain de action de graces avec
correction amyable pleine de cha¬	correction amyable pleine de cha¬
de leurs pechez.	de leurs pechez.
Touchant la facon des excõmu	Touchant la facon des excommu¬
aussi pres est elle de lexcommunie¬	aussi pres est elle de l’excommunie¬
de Dieu/ ⁊ leͬ doctrine de la doctri¬	de Dieu/ et leur doctrine de la doctri¬
ne de Dieu ⁊ leur uie de la uie des	ne de Dieu et leur vie de la vie des
ilz bien leur asnerie/ quand ilz excõ	ilz bien leur asnerie/ quand ilz excom¬
quelque chose/ leq̃l on ne cõgnoist.	quelque chose/ lequel on ne congnoist.
Cõment puis ie fuyr ung tel en la	Comment puis je fuyr ung tel en la
cõgnoy/ ne toi aussi Pape ou eues¬	congnoy/ ne toi aussi Pape ou eves¬
Car par lexcõmuniemẽt il est deffẽ	Car par l’excommuniement il est deffen¬
du aux fideles de ne prẽdre le pain	du aux fideles de ne prendre le pain
nie. Nostre Seigͬ a dit ainsi: Si tõ	nie. Nostre Seigneur a dit ainsi: Si ton
tre toy et luy seul. Sil te escou¬	tre toy et luy seul. S’il te escou¬
te/ tu as gaigne ton frere. Mais	te/ tu as gaigne ton frere. Mais
auec toy: affin que en la bouche	avec toy: affin que en la bouche
rolle. Et sil ne escoute iceulx/ dis	rolle. Et s’il ne escoute iceulx/ dis
le a lassemblee/ a toute la parroisse/	le a l’assemblee/ a toute la parroisse/
dele ⁊ publicain. La nostre Sei¬	dele et publicain. La nostre Sei¬
scaurons auoir failly nous ladmõ	scaurons avoir failly nous l’admon¬
nestons secretemẽt/ ⁊ sil prẽt nostre	nestons secretement/ et s’il prent nostre
Seigneur. Autremẽt/ pour mieulx	Seigneur. Autrement/ pour mieulx
ou troys bõs personnages: lesquelz	ou troys bons personnages: lesquelz
benignement le corrigent ⁊ admõ¬	benignement le corrigent et admon¬
amãder: alors tous ceulx de la par	amander: alors tous ceulx de la par¬
uent prier ⁊ admõnester de soy re¬	vent prier et admonnester de soy re¬
tourner ⁊ laisser son peche. Et si	tourner et laisser son peche. Et si
alors on ne doit cõuerser auec luy¬	alors on ne doit converser avec luy
lequel tu ne uouldroys point uenir	lequel tu ne vouldroys point venir
a la table de nostre Seigͬ ne aussi	a la table de nostre Seigneur ne aussi
ne sa foy. Mais en toute autre sorte	ne sa foy. Mais en toute autre sorte
le gaigner ⁊ retirer. Ainsi fault con	le gaigner et retirer. Ainsi fault con¬
uerser auec lexcommunie en toute	verser avec l’excommunie en toute
De cecy ne gardent rien les pa¬	De cecy ne gardent rien les pa¬
pourtãt le excõmuniemẽt est au¬	pourtant le excommuniement est au¬
tant a craindre cõme une fueille qͥ	tant a craindre comme une fueille qui
a este pour accõplir ce qui a este pre	a este pour accomplir ce qui a este pre¬
la fueille te espouuẽtera cõe le glai	la fueille te espouventera come le glai¬
ue/ ⁊ tu fuyras deuãt luy cõe deuãt	ve/ et tu fuyras devant luy come devant
ment dune fueille de papier/ ou pe¬	ment d’une fueille de papier/ ou pe¬
cire ou de plomb/ comme la mort.	cire ou de plomb/ comme la mort.
Mais la ou est foy/ son aduersaire	Mais la ou est foy/ son adversaire
minations.	minations.
Chap̃.xxxiii.	Chapitre.xxxiii.
L	L¬
me dit le sauueur) uiẽnẽt	me dit le sauveur) viennent
stementz de brebis/ et de¬	stementz de brebis/ et de¬
dans sont loups rauissãtz: lesquelz	dans sont loups ravissantz: lesquelz
a Dieu/ toutesfoys ne seruẽt que a	a Dieu/ toutesfoys ne servent que a
ces seduisent ⁊ pillent les simples.	ces seduisent et pillent les simples.
Ceulx icy ne preschent pas la pu	Ceulx icy ne preschent pas la pu¬
ges ⁊ adinuẽtions/ meslãtz la pail	ges et adinventions/ meslantz la pail¬
hõmes (qͥ est appellee diabolique)	hommes (qui est appellee diabolique)
auec la doctrine de nostre Seigñr/	avec la doctrine de nostre Seigneur/
les inuẽtions pour seduire le peu¬	les inventions pour seduire le peu¬
tantz uie a ceulx qui sõt mortz par	tantz vie a ceulx qui sont mortz par
peche/ iugeantz a mort ceulx qͥ ont	peche/ jugeantz a mort ceulx qui ont
Et sus tout leur doctrine est de	Et sus tout leur doctrine est de
en leͬs maĩs/ ou il est la en la main	en leurs mains/ ou il est la en la main
dũg autre/ ou il est au lieu secret fer	d’ung autre/ ou il est au lieu secret fer¬
cõfermer la ꝑolle par faulx signes	confermer la parolle par faulx signes
serõt deceutz/ cercheãtz ca bas celuy	seront deceutz/ cercheantz ca bas celuy
quil fault cercher la sus a la dextre	qu’il fault cercher la sus a la dextre
Ceulx icy se nourrissẽt eulx mes¬	Ceulx icy se nourrissent eulx mes¬
le laict (cest le trauail des paoures	le laict (c’est le travail des paovres
gẽs) ilz le deuorẽt par tãt de moyẽs	gens) ilz le devorent par tant de moyens
y a aucun gras/ par force de fonda¬	y a aucun gras/ par force de fonda¬
pasture de la parolle de Dieu/ il nẽ	pasture de la parolle de Dieu/ il n’en
est aucune q̃stion: ains la fault des¬	est aucune question: ains la fault des¬
ne auant.	ne avant.
par leurs fruictz uous les cõgnoi¬	par leurs fruictz vous les congnoi¬
strez/ regardez leur orgueil/ enuie/	strez/ regardez leur orgueil/ envie/
si ne pouez autremẽt entendre/ con¬	si ne povez autrement entendre/ con¬
a predict/ quilz ont renõce la foy/ et	a predict/ qu’ilz ont renonce la foy/ et
leur doctrine est diabolique/ poͬtãt	leur doctrine est diabolique/ pourtant
tellement quil nest loysible de soy	tellement qu’il n’est loysible de soy
cõbien que Dieu nen ayt rien deffẽ	combien que Dieu n’en ayt rien deffen¬
du. Et aussi en ce qͥlz deffendẽt les	du. Et aussi en ce qu’ilz deffendent les
soit pires ẽuers Dieu en ung tẽps	soit pires envers Dieu en ung temps
la bouche souillast lhõme/ cõe si la	la bouche souillast l’homme/ come si la
creature que Dieu a dõnee pour en	creature que Dieu a donnee pour en
la deust reiecter: combien que la pa	la deust rejecter: combien que la pa¬
de leur doctrine.	de leur doctrine.
¶ Du bon pasteur.	¶ Du bon pasteur.
L	L¬
steur sus tous/ est nostre	steur sus tous/ est nostre
Seigneur Iesus/ lequel a	Seigneur Jesus/ lequel a
laissant sa refection poͬ nourrir les	laissant sa refection pour nourrir les
parolle. Car sa uiande qͥl desire sus	parolle. Car sa viande qu’il desire sus
tout/ cest de faire la uolũte de dieu	tout/ c’est de faire la volunte de dieu
bis/ il ne parle point de soymesme/	bis/ il ne parle point de soymesme/
parle en luy/ ⁊ oeuure en luy.	parle en luy/ et oeuvre en luy.
Sa doctrine/ est la doctrine de sõ	Sa doctrine/ est la doctrine de son
ne aux prophetes: mais les garde ⁊	ne aux prophetes: mais les garde et
q̃ on contreuiẽne a lescripture: mais	que on contrevienne a l’escripture: mais
faict q̃lle soit accõplie. Selon laq̃lle	faict qu’elle soit accomplie. Selon laquelle
disciples leur ouurãt lintelligẽce di	disciples leur ouvrant l’intelligence d’i¬
niere de faire quon uoit en cestuy	niere de faire qu’on voit en cestuy
bon pasteur/ fault congnoistre les	bon pasteur/ fault congnoistre les
Iesus/ autãt sera lon bon pasteur:	Jesus/ autant sera lon bon pasteur:
tant plus sera lon prochain de Lan	tant plus sera lon prochain de L’an¬
techrist.	techrist.
dele ministre/ despẽsier/ ⁊ seruiteur	dele ministre/ despensier/ et serviteur
dãment desirera la uie ⁊ salut des	damment desirera la vie et salut des
paoures ames/ oubliant soymesme	paovres ames/ oubliant soymesme
chant ce qui est a Iesus ⁊ non pas	chant ce qui est a Jesus et non pas
les brebis a uiure selon la saincte ⁊	les brebis a vivre selon la saincte et
bõne uolũte de Dieu par saine do¬	bonne volunte de Dieu par saine do¬
ne controuuera rien de soy/ ne aussi	ne controuvera rien de soy/ ne aussi
ꝑ autre/ mesme quãd ce seroit ung	par autre/ mesme quand ce seroit ung
ãge du ciel qͥ lauroit trouuee: mais	ange du ciel qui l’auroit trouvee: mais
croyt ꝑfaictemẽt ⁊ ce qui est ferme ⁊	croyt parfaictement et ce qui est ferme et
Ne souffrãt quon mette en nouuel¬	Ne souffrant qu’on mette en nouvel¬
le subiection par tradition ou ordõ	le subjection par tradition ou ordon¬
par nostre Seigñr Iesus. Car tou	par nostre Seigneur Jesus. Car tou¬
tres choses qui sont par dehors/ les	tres choses qui sont par dehors/ les
fideles en peuuent user a lhõneur ⁊	fideles en peuvent user a l’honneur et
re aucune differẽce/ sãs toutesfoys	re aucune difference/ sans toutesfoys
Car tout est franc ⁊ libre au Chre¬	Car tout est franc et libre au Chre¬
stien/ lequel estãt filz de Dieu/ ce qͥ	stien/ lequel estant filz de Dieu/ ce qui
sainctement.	sainctement.
seignera la uraye iustice estre au	seignera la vraye justice estre au
coeur/ leq̃l ayãt uraye ⁊ entiere foy/	coeur/ lequel ayant vraye et entiere foy/
chain pour lamour de Dieu. Ainsi	chain pour l’amour de Dieu. Ainsi
la parolle de Dieu sãs y riẽ mesler/	la parolle de Dieu sans y rien mesler/
est diligẽt apres la saincte escriptu¬	est diligent apres la saincte escriptu¬
prẽdre ⁊ admõnester/ corriger ⁊ en¬	prendre et admonnester/ corriger et en¬
seruẽt a nostre Seigneur selon ses	servent a nostre Seigneur selon ses
sainctz commandemens.	sainctz commandemens.
mariage sera mary dune seule fem	mariage sera mary d’une seule fem¬
ligẽt apres les brebis/ plein de bon¬	ligent apres les brebis/ plein de bon¬
nes meurs/ logeant uoluntiers et	nes meurs/ logeant voluntiers et
qͥ puisse enseigner ⁊ ĩstruire/ nestãt	qui puisse enseigner et instruire/ n’estant
ne a deshonneste ⁊ uilain gaing:	ne a deshonneste et vilain gaing:
mais de bõne cõscience ⁊ iuste/ non	mais de bonne conscience et juste/ non
scauãt bien gouuerner sa maison/	scavant bien gouverner sa maison/
nestete/ nestant pas nouice ⁊ inex¬	nestete/ n’estant pas novice et inex¬
pert: ainsi que la saincte escripture	pert: ainsi que la saincte escripture
tous les fideles apprennent a con¬	tous les fideles apprennent a con¬
luy est cõtraire. Car tout est ordõne	luy est contraire. Car tout est ordonne
autrement de Dieu/ quil nest alle	autrement de Dieu/ qu’il n’est alle
doiuẽt seruir aux brebis/ ⁊ non pas	doivent servir aux brebis/ et non pas
tous ⁊ debout/ ⁊ les brebis cõe les	tous et debout/ et les brebis come les
plus grandz estre assis.	plus grandz estre assis.
Chap̃.xxxu.	Chapitre.xxxv.
Oute la puissance des pa	Oute la puissance des pa¬
steͬs/ est de edifier en biẽ/	steurs/ est de edifier en bien/
ple ꝑ la pure ⁊ simple pa¬	ple par la pure et simple pa¬
peuuẽt faire cõme pasteurs: mais	peuvent faire comme pasteurs: mais
sont tournez en loups rauissantz et	sont tournez en loups ravissantz et
pour les pechez du peuple.	pour les pechez du peuple.
rement euãgelizent/ Dieu parle en	rement evangelizent/ Dieu parle en
eulx par si grãd uertu q̃ les croyãs	eulx par si grand vertu que les croyans
cõfondus. Et iamais messagier	confondus. Et jamais messagier
sera uaincu. Car Dieu (ainsi qͥl a	sera vaincu. Car Dieu (ainsi qu’il a
promis) dõne aux siens bouche et	promis) donne aux siens bouche et
peult resister.	peult resister.
resister a la saĩcte doctrine de dieu/	resister a la saincte doctrine de dieu/
se retourne sur les corps de ceulx qͥ	se retourne sur les corps de ceulx qui
leͬ fault/ mettãtz a mort les urays	leur fault/ mettantz a mort les vrays
les prophetes/ ⁊ nostre Seigñr Ie	les prophetes/ et nostre Seigneur Je¬
sus auec ses apostres. Et ce affin q̃	sus avec ses apostres. Et ce affin que
de la uerite (q̃ les seruiteͬs de Dieu	de la verite (que les serviteurs de Dieu
de/ ⁊ du tout en tout cõtraire a luy.	de/ et du tout en tout contraire a luy.
Ne uoyõs nous pas les liures qͥ	Ne voyons nous pas les livres qui
este bruslez/ ⁊ deffẽdu sur grosse pei	este bruslez/ et deffendu sur grosse pei¬
quoy on uoit bien q̃ le fondemẽt de	quoy on voit bien que le fondement de
ceulx qui les deffendẽt/ ⁊ fõt deffẽ¬	ceulx qui les deffendent/ et font deffen¬
Le uray Chrestien qui est fonde	Le vray Chrestien qui est fonde
ouyr. Ie liray assez de liures ame¬	ouyr. Je liray assez de livres ame¬
nantz tant de raisõs quon scauroit	nantz tant de raisons qu’on scauroit
⁊ telles choses que les superstitieux	et telles choses que les superstitieux
quil soit q̃ ung seul Dieu/ ⁊ que ie	qu’il soit que ung seul Dieu/ et que je
serue ⁊ inuocque autre que luy.	serve et invocque autre que luy.
senerie et rage? la ou liberalement	senerie et rage? la ou liberalement
mocq̃ries/ uilenies/ ⁊ paillardises/	mocqueries/ vilenies/ et paillardises/
chãsõs deshõnestes ⁊ folles/ liures	chansons deshonnestes et folles/ livres
teries ⁊ blasphemes/ uillaines et	teries et blasphemes/ villaines et
la corruption ⁊ perdition de tous	la corruption et perdition de tous
estatz/ en quoy lire de Dieu est inci	estatz/ en quoy l’ire de Dieu est inci¬
permis lyre le sainct euangile aux	permis lyre le sainct evangile aux
le nouueau testamẽt/ contenant la	le nouveau testament/ contenant la
mort ⁊ passion de Iesus/ la doctri¬	mort et passion de Jesus/ la doctri¬
croire/ est deffendu.	croire/ est deffendu.
leil peulx tu iecter tes rays sur tel	leil peulx tu jecter tes rays sur tel
pays? O terre peulx tu porter tel¬	pays? O terre peulx tu porter tel¬
qui ainsi contẽne ⁊ desprise tõ crea¬	qui ainsi contemne et desprise ton crea¬
estes uoꝰ si misericordieux/ ⁊ si tar	estes vous si misericordieux/ et si tar¬
dif a ire ⁊ uengeance contre ung si	dif a ire et vengeance contre ung si
Et aussi nauez uous pas ordonne	Et aussi n’avez vous pas ordonne
ses sainctes ordõnãces q̃ uous luy	ses sainctes ordonnances que vous luy
auez cõmãde nous enseigner soyẽt	avez commande nous enseigner soyent
tes ⁊ dõmageuses a ceulx qͥ les li¬	tes et dommageuses a ceulx qui les li¬
la loy de Mahumet/ laq̃lle persõne	la loy de Mahumet/ laquelle personne
nose lire/ ne parler delle sinon cer¬	n’ose lire/ ne parler d’elle sinon cer¬
⁊ malefiques/ q̃ tous ne losent lire?	et malefiques/ que tous ne l’osent lire?
escrit est ce chose plus saincte/ meil¬	escrit est ce chose plus saincte/ meil¬
leure ⁊ plus utile a tous que ce que	leure et plus utile a tous que ce que
iamais il na este deffendu a ꝑsonne	jamais il n’a este deffendu a personne
risiens/ le peuple des Iuifz/ la Sa	risiens/ le peuple des Juifz/ la Sa¬
maritaine/ uous sõt ilz plus chiers	maritaine/ vous sont ilz plus chiers
nom de uostre filz/ appellez Chre¬	nom de vostre filz/ appellez Chre¬
saincte escripture: ⁊ non pas iceulx	saincte escripture: et non pas iceulx
qui ont le nom de Chrestiẽs? Sei¬	qui ont le nom de Chrestiens? Sei¬
tous eussẽt uostre loy escrite en leͬs	tous eussent vostre loy escrite en leurs
sassent/ q̃ les peres la racõptassent	sassent/ que les peres la racomptassent
a leurs enfãs ⁊ domestiques/ ⁊ que	a leurs enfans et domestiques/ et que
tuz. Uostre sainct euangile doibt	tuz. Vostre sainct evangile doibt
nen parle/ quõ ne le regarde ne lise?	n’en parle/ qu’on ne le regarde ne lise?
Pourquoy auez uous cõmande qͥl	Pourquoy avez vous commande qu’il
te creature: ⁊ ainsi toute creature le	te creature: et ainsi toute creature le
chascun de le lyre.	chascun de le lyre.
O Iuges de iniqͥte/ pourtant q̃	O Juges de iniquite/ pourtant que
(ainsi que Iesus uous est pierre de	(ainsi que Jesus vous est pierre de
de mort) en uoulez uoꝰ priuer les	de mort) en voulez vous priver les
esleuz/ ⁊ ceulx a qͥ Iesus est uraye¬	esleuz/ et ceulx a qui Jesus est vraye¬
sainct euãgile destruict uostre chef	sainct evangile destruict vostre chef
neur a Dieu q̃ sõ oeuure soit cachee	neur a Dieu que son oeuvre soit cachee
a ses enfans cõme nuysible ⁊ mor¬	a ses enfans comme nuysible et mor¬
en le condẽnant/ ⁊ la lumiere tene¬	en le condemnant/ et la lumiere tene¬
ce ⁊ mauuais courage/ sinon de uo	ce et mauvais courage/ sinon de vo¬
stre pere ⁊ maistre le diable? Lequel	stre pere et maistre le diable? Lequel
sefforce dẽpescher que la parolle de	s’efforce d’empescher que la parolle de
nõ sans cause: car cest le seul neces¬	non sans cause: car c’est le seul neces¬
saire poͬ paruenir au royaume eter	saire pour parvenir au royaume eter¬
Cest aussi la lumiere enuoyee du pe	C’est aussi la lumiere envoyee du pe¬
des paoures pecheurs seantz es te¬	des paovres pecheurs seantz es te¬
nebres de mort/ ⁊ pour leur faire cõ	nebres de mort/ et pour leur faire con¬
ou il les a detenu si lõg tẽps: Affin	ou il les a detenu si long temps: Affin
ble aux paoures abusez belle ⁊ plai	ble aux paovres abusez belle et plai¬
sante pour les ceremonies/ signes ⁊	sante pour les ceremonies/ signes et
opiniõs ⁊ se cõuertissent a la uraye	opinions et se convertissent a la vraye
christ ꝯduisãt en uie eternelle. Du¬	christ conduisant en vie eternelle. Du¬
quel le regne sera sans fin/ ⁊ domi¬	quel le regne sera sans fin/ et domi¬
serez q̃lque ioͬ humiliez ⁊ mis soubz	serez quelque jour humiliez et mis soubz
q̃ ne eussiez iamais este naiz/ quand	que ne eussiez jamais este naiz/ quand
permettez bateleurs ⁊ tous liures/	permettez bateleurs et tous livres/
gile ⁊ les liures qui le contiẽnẽt/ en	gile et les livres qui le contiennent/ en
Leuez uous Seigñr/ mõstrez q̃	Levez vous Seigneur/ monstrez que
cest uostre plaisir q̃ uostre filz soit	c’est vostre plaisir que vostre filz soit
royaume soyẽt publiees/ cõgneues	royaume soyent publiees/ congneues
cõgnoissent par uostre filz/ depuis	congnoissent par vostre filz/ depuis
le plus grãd iusq̃ au plꝰ petit. Fai¬	le plus grand jusque au plus petit. Fai¬
le soit ouye iusque a la fin ⁊ bout du	le soit ouye jusque a la fin et bout du
euãgelizateurs/ destruisez tous se¬	evangelizateurs/ destruisez tous se¬
meurs derreur: affin q̃ toute la ter¬	meurs d’erreur: affin que toute la ter¬
adore ⁊ honnore.	adore et honnore.
urays pasteurs/ et quelle	vrays pasteurs/ et quelle
obedience et honneur on	obedience et honneur on
C	C¬
pasteͬs/ doiuẽt tout prou	pasteurs/ doivent tout prou¬
uer ⁊ iuger ce quilz disẽt/	ver et juger ce qu’ilz disent/
⁊ regarder diligẽmẽt/ si ce	et regarder diligemment/ si ce
non pas a cause diceluy qui la por¬	non pas a cause d’iceluy qui la por¬
te: mais pourtant que cest la parol¬	te: mais pourtant que c’est la parol¬
Et se ilz trouuent q̃ on porte au¬	Et se ilz trouvent que on porte au¬
bien garde de y donner foy ne de y	bien garde de y donner foy ne de y
croire/ mesmement quand ce seroit	croire/ mesmement quand ce seroit
de Dieu/ ou ung ange du ciel qui	de Dieu/ ou ung ange du ciel qui
pure parolle de Dieu/ nous nen de¬	pure parolle de Dieu/ nous n’en de¬
uons rien tenir ne croire. Car autre	vons rien tenir ne croire. Car autre
parolle de Dieu/ de laquelle lescri¬	parolle de Dieu/ de laquelle l’escri¬
te q̃ tout ce qͥ nest apertement prou¬	te que tout ce qui n’est apertement prou¬
ue par lescripture/ on ne le doit poĩt	ve par l’escripture/ on ne le doit point
ueau sur la terre/ quil ne le ayt pre¬	veau sur la terre/ qu’il ne le ayt pre¬
Quand dõc la parolle est portee	Quand donc la parolle est portee
puremẽt selon la saincte escripture	purement selon la saincte escripture
Dieu/ ⁊ receoit on nostre Seigͬ en	Dieu/ et receoit on nostre Seigneur en
celuy qui nous porte la doctrine de	celuy qui nous porte la doctrine de
uie. Car Dieu a ordõne q̃ celuy qui	vie. Car Dieu a ordonne que celuy qui
uiue de leuãgile. Pourtant ceulx qͥ	vive de l’evangile. Pourtant ceulx qui
de Dieu/ ilz doiuent cõmuniquer a	de Dieu/ ilz doivent communiquer a
celuy qui leur sert en la parolle/ en	celuy qui leur sert en la parolle/ en
gras pourceau: cõe on a nourry les	gras pourceau: come on a nourry les
Ne aussi laissantz auoir indigen	Ne aussi laissantz avoir indigen¬
ce: mais le nourrissant ⁊ uestãt en	ce: mais le nourrissant et vestant en
office/ sans estre enfle par labõdãce	office/ sans estre enfle par l’abondance
faire autremẽt quil ne doit par ne¬	faire autrement qu’il ne doit par ne¬
cessite. Mais ayt une moyẽne suffi	cessite. Mais ayt une moyenne suffi¬
honneurs quon doit a lancien/ au	honneurs qu’on doit a l’ancien/ au
uangile.	vangile.
¶ Du glaiue ⁊ puissance de	¶ Du glaive et puissance de
Chap̃.xxxuii.	Chapitre.xxxvii.
Ous sommes cõposez de	Ous sommes composez de
deux choses fort ꝯtraires:	deux choses fort contraires:
me ⁊ lesperit ayãt cõgnois	me et l’esperit ayant congnois¬
⁊ hors ð seruitude trãsferee de mort	et hors de servitude transferee de mort
a uie/ de peche a iustice/ de ire a la¬	a vie/ de peche a justice/ de ire a l’a¬
ainsi selon lesperit ny a q̃ ung seul	ainsi selon l’esperit n’y a que ung seul
Il nya hõme ne fẽme/ masle ne fe¬	Il n’y a homme ne femme/ masle ne fe¬
melle/ seruiteur ne seigneur/ serf ne	melle/ serviteur ne seigneur/ serf ne
riorite ne de subiection: car tous sõ¬	riorite ne de subjection: car tous som¬
Mais selon le corps leq̃l est enco	Mais selon le corps lequel est enco¬
re subiect a corruption/ duquel noꝰ	re subject a corruption/ duquel nous
differẽce. Il ya pere/ mere ⁊ enfãt:	difference. Il y a pere/ mere et enfant:
lenfant/ ⁊ lẽfant subiect. Il ya ma¬	l’enfant/ et l’enfant subject. Il y a ma¬
ry qͥ est seigneur ⁊ chef de la fẽme/ ⁊	ry qui est seigneur et chef de la femme/ et
ce du mary. Seigñr ⁊ seruiteͬ/ frãc	ce du mary. Seigneur et serviteur/ franc
Et tout cecy selon lordõnãce de	Et tout cecy selon l’ordonnance de
Dieu immuable: leq̃l pour la deffẽ	Dieu immuable: lequel pour la deffen¬
ne en corps nen biẽs/ ⁊ pour la pu¬	ne en corps n’en biens/ et pour la pu¬
a autruy a institue la puissance du	a autruy a institue la puissance du
glaiue/ les Roys/ Princes ⁊ seigͬs:	glaive/ les Roys/ Princes et seigneurs:
de iustice. Et affin quilz puissent	de justice. Et affin qu’ilz puissent
la main forte ueillantz ⁊ gardantz	la main forte veillantz et gardantz
quon ne face tort a nully/ tenantz	qu’on ne face tort a nully/ tenantz
les tributz/ impostz/ ⁊ autres cho¬	les tributz/ impostz/ et autres cho¬
Il est uray si tout le mõde auoit	Il est vray si tout le monde avoit
la uraye ⁊ parfaicte cõgnoissãce de	la vraye et parfaicte congnoissance de
plantee au coeͬ dung chascun: telle	plantee au coeur d’ung chascun: telle¬
de Dieu/ ne faisãt a autruy ce q̃ on	de Dieu/ ne faisant a autruy ce que on
ne uouldroit estre faict a soymes¬	ne vouldroit estre faict a soymes¬
pour deffendre les bõs: car persõne	pour deffendre les bons: car personne
nir les mauuais: car il nen seroit	nir les mauvais: car il n’en seroit
point. Mais ainsi q̃ Iesus a sõ re¬	point. Mais ainsi que Jesus a son re¬
bõs on este ⁊ serõt parmy les mau¬	bons on este et seront parmy les mau¬
tant q̃ ce corps q̃ nous portõs dure.	tant que ce corps que nous portons dure.
Pourtãt il fault q̃ le glaiue ⁊ la	Pourtant il fault que le glaive et la
estre aussi tous subiectz a ceste puis¬	estre aussi tous subjectz a ceste puis¬
ue/ le corps ⁊ biẽs/ soit que la iustice	ve/ le corps et biens/ soit que la justice
use bien ou mal/ quãd en luy obeis/	use bien ou mal/ quand en luy obeis¬/
mãdemẽs de Dieu. Car la il fault	mandemens de Dieu. Car la il fault
Quand dõc la iustice impose tri	Quand donc la justice impose tri¬
but/ cõmãde de laisser le pays/ que	but/ commande de laisser le pays/ que
se/ il fault obeir. Mais si elle com	se/ il fault obeir. Mais si elle com¬
periurer/ faire mal/ battre pere ou	perjurer/ faire mal/ battre pere ou
mere/ ou les maudire/ tuer/ battre/	mere/ ou les maudire/ tuer/ battre/
obeir a Dieu seul/ ⁊ non aux hões.	obeir a Dieu seul/ et non aux homes.
offenser Dieu/ fault obeir/ rendãtz	offenser Dieu/ fault obeir/ rendantz
tout ce qͥ luy appartient/ rẽtes/ cẽsi¬	tout ce qui luy appartient/ rentes/ censi¬
Ceulx qͥ sont en superiorite ⁊ ont	Ceulx qui sont en superiorite et ont
cõmẽt ilz usent diceluy ⁊ de la puis¬	comment ilz usent d’iceluy et de la puis¬
sance/ sachant q̃ la sus est celuy qui	sance/ sachant que la sus est celuy qui
mis pour traicter ⁊ cõduire les sub¬	mis pour traicter et conduire les sub¬
de ses enfãs/ rẽdantz a ung chascũ	de ses enfans/ rendantz a ung chascun
ce quil luy appartient/ sans auoir	ce qu’il luy appartient/ sans avoir
riche/ ne du petit ne du grand/ de	riche/ ne du petit ne du grand/ de
non exẽpte (cõme cõtre Dieu et la	non exempte (comme contre Dieu et la
saincte puissance a este cõtrouuee)	saincte puissance a este controuvee)
ne de prẽdre dõs. Car dautãt qͥlz	ne de prendre dons. Car d’autant qu’ilz
ayantz tel honneur destre appellez	ayantz tel honneur d’estre appellez
aussi filz du treshault/ dautãt le iu¬	aussi filz du tres hault/ d’autant le ju¬
ne respondẽt a leur office/ ⁊ ne gar¬	ne respondent a leur office/ et ne gar¬
que Dieu leur a commise.	que Dieu leur a commise.
Les subiectz aussi se donnẽt bien	Les subjectz aussi se donnent bien
leurs seigneͬs ne de resister a eulx.	leurs seigneurs ne de resister a eulx.
