¶ Letres certaines dau	¶ Letres certaines d’au¬
quauez allegue. Ilz ont ꝓpose la saincte	qu’avez allegue. Ilz ont propose la saincte
escripture/ ⁊ prins conseil a toute lassem	escripture/ et prins conseil a toute l’assem¬
blee des fideles/ lesq̃lz ont esleu en priant	blee des fideles/ lesquelz ont esleu en priant
nostre Seigñr/ ceulx qui deuoient seruir	nostre Seigneur/ ceulx qui devoient servir
paoures/ laduis dung chascun estoit ouy	paovres/ l’advis d’ung chascun estoit ouy
⁊ la parolle de Dieu mise en auant. De	et la parolle de Dieu mise en avant. De
tout cecy quest ce quil en y a maintenant	tout cecy qu’est ce qu’il en y a maintenant
en toute Leglise Romaine? Rien. Uous	en toute L’eglise Romaine? Rien. Vous
iuges ⁊ parties/ uous taillez ⁊ cousez cõ¬	juges et parties/ vous taillez et cousez com¬
chassez/ battus/ ẽprisonnez/ lapidez/ tuez	chassez/ battus/ emprisonnez/ lapidez/ tuez
et meurtris/ portans tout patiemment/	et meurtris/ portans tout patiemment/
prians pour leurs ennemys/ non point	prians pour leurs ennemys/ non point
condẽnans ⁊ emprisonnans. Et suys es¬	condemnans et emprisonnans. Et suys es¬
bahy cõment on ose dire que Leglise du	bahy comment on ose dire que L’eglise du
Pape soit cõduicte par le Sainct esperit	Pape soit conduicte par le Sainct esperit
cõe la premiere/ ⁊ que Iesus y soit. Pour	come la premiere/ et que Jesus y soit. Pour
⁊ Iesus seroit bien chãge. Mais lesperit	et Jesus seroit bien change. Mais l’esperit
de Dieu cõduict ceulx qui de p̃sent sont	de Dieu conduict ceulx qui de present sont
persecutez/ chassez/ emprisonnez/ bruslez	persecutez/ chassez/ emprisonnez/ bruslez
pour Leuãgile/ cõme ont este ceulx de la	pour L’evangile/ comme ont este ceulx de la
autremẽt cõment pourroiẽt ilz subsister/	autrement comment pourroient ilz subsister/
ueu quon tormẽte de present plus cruel¬	veu qu’on tormente de present plus cruel¬
lemẽt ceulx qui ueulent tenir Leuãgile/	lement ceulx qui veulent tenir L’evangile/
que iamais on ne tormenta les Apostres	que jamais on ne tormenta les Apostres
la predict que lafflictiõ seroit plus grãde	l’a predict que l’affliction seroit plus grande
q̃ point na este ⁊ ne sera. Matthieu.24.	que point n’a este et ne sera. Matthieu.24.
Mais il fault par foy ⁊ patiẽce uaincre/	Mais il fault par foy et patience vaincre/
attendant que nostre Seigneur abbate	attendant que nostre Seigneur abbate
salo.2. ce quil a comence/ ⁊ parfaira fai¬	salo.2. ce qu’il a comence/ et parfaira fai¬
sant uengeance du sang iuste qui a este	sant vengeance du sang juste qui a este
espandu pour Iesus ⁊ son Euangile.	espandu pour Jesus et son Evangile.
Nostre Maistre.	Nostre Maistre.
Prestre. Car en ung Diocese na qung	Prestre. Car en ung Diocese n’a q’ung
Euesque: mais y peult auoir plusieurs	Evesque: mais y peult avoir plusieurs
Prestres/ lesq̃lz sont subiectz aux Eues¬	Prestres/ lesquelz sont subjectz aux Eves¬
ques. Et qͥl soit ainsi/ il est clair q̃ nostre	ques. Et qu’il soit ainsi/ il est clair que nostre
thieu.10. Et yceulx ont este Euesques/	thieu.10. Et yceulx ont este Evesques/
ainsi quil appert de Iudas/ duquel il est	ainsi qu’il appert de Judas/ duquel il est
escript: Son Euesche ung autre le prẽne	escript: Son Evesche ung autre le prenne
Actes.1. Puys quil auoit ung Euesche/	Actes.1. Puys qu’il avoit ung Evesche/
les Apostres/ nr̃e Seigñr a esleu septãte	les Apostres/ notre Seigneur a esleu septante
deux disciples/ lesquelz nestoient point	deux disciples/ lesquelz n’estoient point
Apostres ne Euesques/ mais disciples et	Apostres ne Evesques/ mais disciples et
Prestres. Et ceste difference bien appert	Prestres. Et ceste difference bien appert
uesque soit irreprehensible/ mary dune	vesque soit irreprehensible/ mary d’une
femme. Et pourtant puys quil y a diffe	femme. Et pourtant puys qu’il y a diffe¬
rẽce entre les Apostres ⁊ les septãte deux	rence entre les Apostres et les septante deux
disciples: il fault quil y aye difference en¬	disciples: il fault qu’il y aye difference en¬
grez ⁊ dignitez differentes/ ainsi quil est	grez et dignitez differentes/ ainsi qu’il est
escript. Ephesiens.4. que nostre Seigñr	escript. Ephesiens.4. que nostre Seigneur
a donne en Leglise les ungs Apostres/	a donne en L’eglise les ungs Apostres/
les autres Prophetes/ les autres Euan	les autres Prophetes/ les autres Evan¬
Et nest pas ainsi que plusieurs estiment	Et n’est pas ainsi que plusieurs estiment
ne tenãs compte des uniuersitez ne des	ne tenans compte des universitez ne des
docteurs cõe aussi de lautorite des Eues	docteurs come aussi de l’autorite des Eves¬
ques ⁊ des pasteurs. Car il fault quẽ Le	ques et des pasteurs. Car il fault qu’en L’e¬
grãd ⁊ superieur aux Diacres/ ainsi Le	grand et superieur aux Diacres/ ainsi L’e¬
uesque est plus grand et superieur aux	vesque est plus grand et superieur aux
Prestres. Et en ung Diocese ⁊ uille na	Prestres. Et en ung Diocese et ville n’a
qung Euesque: mais plusieͬs Prestres.	q’ung Evesque: mais plusieurs Prestres.
soubz ung Archeuesque/ ⁊ les Archeues¬	soubz ung Archevesque/ et les Archeves¬
ques soubz le Primat/ ⁊ ainsi par degrez	ques soubz le Primat/ et ainsi par degrez
lung sur lautre iusques au Pape/ qui est	l’ung sur l’autre jusques au Pape/ qui est
sus tous cõe chef/ constitue sus tous cõ¬	sus tous come chef/ constitue sus tous com¬
Le Predicant.	Le Predicant.
Uoꝰ dõnerez beaucop de testes ⁊ de chefz	Vous donnerez beaucop de testes et de chefz
en Leglise ⁊ ferez beaucop de dieux. Lon	en L’eglise et ferez beaucop de dieux. L’on
uous a assez clairement monstre cõment	vous a assez clairement monstre comment
point de successeur. Car il est tousiours	point de successeur. Car il est tousjours
uiuant/ ⁊ nest pas cõme les autres/ qui	vivant/ et n’est pas comme les autres/ qui
par la mort sont empeschez de perseuerer	par la mort sont empeschez de perseverer
⁊ de faire leur office: mais Iesus uiuant	et de faire leur office: mais Jesus vivant
la siẽne/ nõ point celle du Pape de ceulx	la sienne/ non point celle du Pape de ceulx
qui ne suyuent Leuangile. Et quant	qui ne suyvent L’evangile. Et quant
est de la differẽce du Prestre ⁊ de Leuesq̃:	est de la difference du Prestre et de L’evesque:
Il est clair par lescripture que cest une	Il est clair par l’escripture que c’est une
uant a Tite au premier chapitre: Ie tay	vant a Tite au premier chapitre: Je t’ay
laisse en Candie pour corriger ce qͥ fault/	laisse en Candie pour corriger ce qui fault/
et que tu ordonne par chascune cite des	et que tu ordonne par chascune cite des
Prestres/ cõe ie tauoye ordõne/ si aucun	Prestres/ come je t’avoye ordonne/ si aucun
ses enfans fideles non subiectz a super¬	ses enfans fideles non subjectz a super¬
fluite/ ⁊ qͥlz ne soient point intractables.	fluite/ et qu’ilz ne soient point intractables.
Car il fault que Leuesque soit sans blas¬	Car il fault que L’evesque soit sans blas¬
me/ comme despensier de Dieu. Auoir	me/ comme despensier de Dieu. Avoir
estre sans blasme/ ⁊ ayant une femme/ il	estre sans blasme/ et ayant une femme/ il
dit: Car il fault que Leuesque soit sans	dit: Car il fault que L’evesque soit sans
blasme. Si Leuesque ⁊ le Prestre estoiẽt	blasme. Si L’evesque et le Prestre estoient
deux/ poͬ quoy diroit il: Car il fault que	deux/ pour quoy diroit il: Car il fault que
mesme chose? Et ce que Lapostre dit en	mesme chose? Et ce que L’apostre dit en
ceste epistre du Prestre/ il la dit. 1.Timo	ceste epistre du Prestre/ il l’a dit. 1.Timo¬
thee.3. de Leuesque. Et aussi appert aux	thee.3. de L’evesque. Et aussi appert aux
Actes.20. ou il est dit/ que sainct Paul a	Actes.20. ou il est dit/ que sainct Paul a
se. Et parlant a eulx leur dit: Donnez	se. Et parlant a eulx leur dit: Donnez
uous garde a uous ⁊ a tout le tropeau/	vous garde a vous et a tout le tropeau/
auquel le S. esperit uous a mis Eues¬	auquel le sainct esperit vous a mis Eves¬
ques. Ceulx qͥl a dit Prestres/ il appelle	ques. Ceulx qu’il a dit Prestres/ il appelle
une mesme chose. Et cõe parauãt auõs	une mesme chose. Et come paravant avons
monstre/ que Sainct Pierre ne sappelle	monstre/ que Sainct Pierre ne s’appelle
Pape ne Archeuesque/ mais Prestre cõ¬	Pape ne Archevesque/ mais Prestre com¬
me les autres. 1.Pierre.5. Car ce q̃ uous	me les autres. 1.Pierre.5. Car ce que vous
cite ⁊ Diocese/ ⁊ ny en a q̃ ung: assez est	cite et Diocese/ et n’y en a que ung: assez est
clair de ceulx de Ephese qui estoient plu	clair de ceulx de Ephese qui estoient plu¬
sieurs ⁊ en la cite de Philippes ou sem¬	sieurs et en la cite de Philippes ou sem¬
blablemẽt estoient plusieurs/ cõme mon¬	blablement estoient plusieurs/ comme mon¬
en Iesus Christ qui sont en Philippes	en Jesus Christ qui sont en Philippes
auec les Euesques ⁊ les Diacres. Phi¬	avec les Evesques et les Diacres. Phi¬
lippiẽs.1. Et cõbien que nostre Seigñr	lippiẽs.1. Et combien que nostre Seigneur
aye ordõne douze Apostres/ ⁊ que iceulx	aye ordonne douze Apostres/ et que iceulx
il aye ordonne les septante ⁊ non point	il aye ordonne les septante et non point
septante deux/ il ne sensuyt point: cõbien	septante deux/ il ne s’ensuyt point: combien
que les Apostres ayent este Euesques/ q̃	que les Apostres ayent este Evesques/ que
les septante ne layent este. Car Euesque	les septante ne l’ayent este. Car Evesque
⁊ de seigneurie: mais doffice ⁊ de seruitu¬	et de seigneurie: mais d’office et de servitu¬
de poͬ seruir a Leglise. Et lung est prins	de pour servir a L’eglise. Et l’ung est prins
de leage/ signifiãt ancien/ autãt que Pre	de leage/ signifiant ancien/ autant que Pre¬
stre. Lautre dauoir lesgard ⁊ de ueiller.	stre. L’autre d’avoir l’esgard et de veiller.
le regard sus le peuple. Car il fault que	le regard sus le peuple. Car il fault que
celuy qui porte la parolle de Dieu/ soit	celuy qui porte la parolle de Dieu/ soit
ancien de meurs et de scauoir pour estre	ancien de meurs et de scavoir pour estre
la forme au peuple/ cõme dit S. Pierre/	la forme au peuple/ comme dit sainct Pierre/
peuple qui est lheritaige de Dieu: mais	peuple qui est l’heritaige de Dieu: mais
soyez (dit il) la forme au tropeau. 1.Pier	soyez (dit il) la forme au tropeau. 1.Pier¬
re.5. cõme aussi S. Paul le monstre quil	re.5. comme aussi sainct Paul le monstre qu’il
soit irreprehensible/ mary dune femme/	soit irreprehensible/ mary d’une femme/
talite/ ꝓpre a enseigner/ nõ point adõne	talite/ propre a enseigner/ non point adonne
a uin/ non batteur/ nestãt adonne a ui¬	a vin/ non batteur/ n’estant adonne a vi¬
lain gaing: mais iuste/ loing de noyse et	lain gaing: mais juste/ loing de noyse et
dauarice/ qui gouuerne bien sa maison/	d’avarice/ qui gouverne bien sa maison/
nestete. 1.Timoth.3. ⁊ a Tite.1. Et aussi	nestete. 1.Timoth.3. et a Tite.1. Et aussi
fault quil soit ancien en scauoir pour en¬	fault qu’il soit ancien en scavoir pour en¬
seigner/ exhorter/ ⁊ pour cõuaincre les cõ	seigner/ exhorter/ et pour convaincre les con¬
tredisans/ ausquelz fault boucher et fer¬	tredisans/ ausquelz fault boucher et fer¬
le feu/ leaue/ la corde et le bourreau/ par	le feu/ leave/ la corde et le bourreau/ par
prisons ⁊ rauissemẽs des biẽs: mais par	prisons et ravissemens des biens: mais par
saine doctrine. Et en cecy doit ueiller le	saine doctrine. Et en cecy doit veiller le
Prestre/ Leuesque/ cõme bon ministre de	Prestre/ L’evesque/ comme bon ministre de
ple soit parfaict a Dieu/ linstruysãt/ cor	ple soit parfaict a Dieu/ l’instruysant/ cor¬
rigeant/ admõnestant/ reprenant par la	rigeant/ admonnestant/ reprenant par la
saincte escripture/ qui est ꝓpre a ce. 2.Ti	saincte escripture/ qui est propre a ce. 2.Ti¬
mothee.3. Et ce que uous amenez que	mothee.3. Et ce que vous amenez que
Euesques sont au lieu des Apostres/ et	Evesques sont au lieu des Apostres/ et
pleut a Dieu quilz ne fussent au lieu de	pleut a Dieu qu’ilz ne fussent au lieu de
Iudas. Et que les disciples estoiẽt Pre¬	Judas. Et que les disciples estoient Pre¬
stres/ ⁊ les Prestres sont au lieu des dis¬	stres/ et les Prestres sont au lieu des dis¬
cõment Timothee nestoit point Apostre	comment Timothee n’estoit point Apostre
mais disciple. Actes.16. ⁊ ainsi estoit par	mais disciple. Actes.16. et ainsi estoit par
uous simple Prestre ⁊ nõ Euesque. Et	vous simple Prestre et non Evesque. Et
cõment seroit ce qung simple Prestre con	comment seroit ce q’ung simple Prestre con¬
mothee en a la charge/ et Tite aussi qui	mothee en a la charge/ et Tite aussi qui
nestoiẽt point Apostres/ mais disciples?	n’estoient point Apostres/ mais disciples?
La premiere Eglise de Dieu na point	La premiere Eglise de Dieu n’a point
sceu telle distinction ne superiorite: mais	sceu telle distinction ne superiorite: mais
que dominer ⁊ non de seruir/ au contraire	que dominer et non de servir/ au contraire
de Iesus qui est uenu pour seruir ⁊ non	de Jesus qui est venu pour servir et non
point poͬ estre seruy. Et puys quauez	point pour estre servy. Et puys qu’avez
amene ce bon Euesque Iudas qui a uẽ¬	amene ce bon Evesque Judas qui a ven¬
ung Euesche/ ⁊ estoit constitue sus ung	ung Evesche/ et estoit constitue sus ung
Diocese/ leq̃l est ce? ou est cest Euesche?	Diocese/ lequel est ce? ou est cest Evesche?
cõbien uault il in portatis? Certes point	combien vault il in portatis? Certes point
de lieu na eu: mais il deuoit prescher cõe	de lieu n’a eu: mais il devoit prescher come
ung Diocese. Mais bien luy cõuiẽt auec	ung Diocese. Mais bien luy convient avec
les Euesques qui au lieu de porter la pa	les Evesques qui au lieu de porter la pa¬
rolle de Dieu/ portẽt la bourse desrobãs	rolle de Dieu/ portent la bourse desrobans
ce que doit uenir aux paoures/ ⁊ uendẽt	ce que doit venir aux paovres/ et vendent
paoures ames au diable par toute idola	paovres ames au diable par toute idola¬
trie ⁊ superstitiõ/ mais qͥlz ayent argent.	trie et superstition/ mais qu’ilz ayent argent.
Et si aucun parle cõtre eulx en le bãnis¬	Et si aucun parle contre eulx en le bannis¬
sant/ cest lauoir declaire estre heretique/	sant/ c’est l’avoir declaire estre heretique/
mort. Cecy est bien loing des Apostres/	mort. Cecy est bien loing des Apostres/
des Euãgelistes/ Prophetes/ Pasteurs	des Evangelistes/ Prophetes/ Pasteurs
⁊ Docteurs: nõ point par letres ⁊ seaux	et Docteurs: non point par letres et seaux
apres les grans bancquetz doctoreaux ⁊	apres les grans bancquetz doctoreaux et
esperit en iusnes/ oraisõs/ ⁊ sainctes prie	esperit en jusnes/ oraisons/ et sainctes prie¬
res/ ainsi qua este enuoye Sainct Paul.	res/ ainsi qu’a este envoye Sainct Paul.
Act.13. Et si Leglise estoit ainsi cõduicte/	Act.13. Et si L’eglise estoit ainsi conduicte/
le paoure peuple ne seroit ainsi mange et	le paovre peuple ne seroit ainsi mange et
gelique/ lon prieroit pour les ignorans/	gelique/ l’on prieroit pour les ignorans/
⁊ les Prestres ⁊ Prĩces des Iuifz Anne	et les Prestres et Princes des Juifz Anne
⁊ Cayphe ne cryeroient point/ oste/ oste/	et Cayphe ne cryeroient point/ oste/ oste/
crucifie/ crucifie/ faisãs que le sang inno¬	crucifie/ crucifie/ faisans que le sang inno¬
successeurs Danne et Cayphe suyuans	successeurs D’anne et Cayphe suyvans
bien leurs deuãtiers font par tout: ainsi	bien leurs devantiers font par tout: ainsi
quõ a faict a Iesus ⁊ ses Apostres/ font	qu’on a faict a Jesus et ses Apostres/ font
ilz a ceulx qui les ueulent suyure.	ilz a ceulx qui les veulent suyvre.
Uous estes fort cõtre les Euesq̃s. Allez	Vous estes fort contre les Evesques. Allez
dire ce que uoꝰ dictes a Paris ou es au¬	dire ce que vous dictes a Paris ou es au¬
tres uilles de france. Il est tout clair qͥl	tres villes de france. Il est tout clair qu’il
y a differẽce entre Leuesque ⁊ le Prestre.	y a difference entre L’evesque et le Prestre.
me aussi nest point une mesme chose des-	me aussi n’est point une mesme chose des-
dictz Apostres ⁊ des disciples. Or estoiẽt	dictz Apostres et des disciples. Or estoient
les Apostres Euesques cõe ie lay prouue	les Apostres Evesques come je l’ay prouve
de Iudas. Et ce que uous alleguez de	de Judas. Et ce que vous alleguez de
Prestre/ ce qui est uray. Car du degre de	Prestre/ ce qui est vray. Car du degre de
Prestrise on uiẽt a la dignite episcopale.	Prestrise on vient a la dignite episcopale.
Cela aussi que uous auez amene des	Cela aussi que vous avez amene des
Actes/ que S. Paul a faict appeller les	Actes/ que sainct Paul a faict appeller les
Euesques/ est dit pourtant que S. Paul	Evesques/ est dit pourtant que sainct Paul
fit la ung concil/ cõe alors ilz en auoient	fit la ung concil/ come alors ilz en avoient
la coustume: ⁊ en ce cõcil y auoit des Pre	la coustume: et en ce concil y avoit des Pre¬
stres ⁊ des Euesques/ non point que ces	stres et des Evesques/ non point que ces
lieu/ mais de plusieurs. Ainsi est uray	lieu/ mais de plusieurs. Ainsi est vray¬
semblable que les Euesques de lentour	semblable que les Evesques de l’entour
de Philippes estoiẽt poͬ ung cõcil assẽ¬	de Philippes estoient pour ung concil assem¬
blez a Philippes/ ⁊ Lapostre leͬ rescript/	blez a Philippes/ et L’apostre leur rescript/
Euesques. Et fault quen Leglise y aye	Evesques. Et fault qu’en L’eglise y aye
les distinctions de degrez/ ⁊ de dignitez/	les distinctions de degrez/ et de dignitez/
ainsi cõme parauant ay mõstre/ tant de	ainsi comme paravant ay monstre/ tant de
docteurs q̃ de pasteurs ⁊ superiorite pour	docteurs que de pasteurs et superiorite pour
partient de faire ordonnances/ ainsi quil	partient de faire ordonnances/ ainsi qu’il
est expedient/ ⁊ faire decisiõs cõme le cas	est expedient/ et faire decisions comme le cas
le requiert. Et ne fault confondre les di¬	le requiert. Et ne fault confondre les di¬
gnitez: mais que tout soit garde ainsi qͥl	gnitez: mais que tout soit garde ainsi qu’il
donnees/ ⁊ ne fault que a lappetit dung	donnees/ et ne fault que a l’appetit d’ung
chascun/ quelles soient chãgees. Il y a eu	chascun/ qu’elles soient changees. Il y a eu
tant de bons Euesques ⁊ tant de gẽs de	tant de bons Evesques et tant de gens de
bien iusques a present. Et ne fault pẽser	bien jusques a present. Et ne fault penser
cõbien que les ministres ⁊ prelatz dicelle	combien que les ministres et prelatz d’icelle
faillent en beaucop/ ne faisans leur offi¬	faillent en beaucop/ ne faisans leur offi¬
ce. Mais si fault il que Leglise demeu¬	ce. Mais si fault il que L’eglise demeu¬
re ⁊ les dignitez dicelle/ et son autorite et	re et les dignitez d’icelle/ et son autorite et
Le Predicant.	Le Predicant.
Ie suys tellement contre les Euesques/	Je suys tellement contre les Evesques/
que ie uouldroye auoir mis ma uie/ qͥlz	que je vouldroye avoir mis ma vie/ qu’ilz
fussent cõe les Apostres/ ausquelz uous	fussent come les Apostres/ ausquelz vous
ques icy/ quãd sera son bon plaisir/ il me	ques icy/ quand sera son bon plaisir/ il me
cõduyra iusques a Paris ⁊ autres lieux	conduyra jusques a Paris et autres lieux
de France/ ainsi quil est tout puyssant/	de France/ ainsi qu’il est tout puyssant/
seul gouuerneur du ciel ⁊ de la terre/ qui	seul gouverneur du ciel et de la terre/ qui
me uoulsit faire cõme a uous/ me ꝑmet¬	me voulsit faire comme a vous/ me permet¬
tant respõdre ⁊ rendre raison de ma foy.	tant respondre et rendre raison de ma foy.
Ie ne demanderoye point estre remis a	Je ne demanderoye point estre remis a
mon iuge: mais seroye trop cõtent (cõme	mon juge: mais seroye trop content (comme
maintenir ce que ie dy: ⁊ si ie ne le pouoye	maintenir ce que je dy: et si je ne le povoye
mõstrer/ estre mis a mort/ sans demãder	monstrer/ estre mis a mort/ sans demander
quõ fist aucũ desplaisir a Euesq̃/ Prestre	qu’on fist aucun desplaisir a Evesque/ Prestre
ou Moyne/ cõbien que clairemẽt ilz errẽt	ou Moyne/ combien que clairement ilz errent
⁊ erreurs. Uous declairez dune belle sor	et erreurs. Vous declairez d’une belle sor¬
te S. Paul/ ou il parle de linstitution de	te sainct Paul/ ou il parle de l’institution de
Leuesq̃. Sil estoit ainsi cõe uous dictes	L’evesque. S’il estoit ainsi come vous dictes
quilz fussent diuers/ ce qui ne peult estre:	qu’ilz fussent divers/ ce qui ne peult estre:
te.1. Pourquoy auoir parle de lestat de	te.1. Pourquoy avoir parle de l’estat de
Leuesq̃ na parle du Prestre/ nest il pas	L’evesque n’a parle du Prestre/ n’est il pas
aussi necessaire cõe des Diacres? Il par¬	aussi necessaire come des Diacres? Il par¬
le cõment ⁊ quelles doyuẽt estre les fem¬	le comment et quelles doyvent estre les fem¬
il point autant necessaire de parler des	il point autant necessaire de parler des
Prestres? Ou trouuez uous que le cõcil	Prestres? Ou trouvez vous que le concil
fut assẽble a Milet/ ou a Philippes? Et	fut assemble a Milet/ ou a Philippes? Et
si le cõcil fut assemble a Philippes ⁊ que	si le concil fut assemble a Philippes et que
il point de Prestres/ que S. Paul neust	il point de Prestres/ que sainct Paul n’eust
faict mẽtion de yceulx/ cõe des Diacres?	faict mention de yceulx/ come des Diacres?
Mais uous parlez a plaisir ⁊ sans escri¬	Mais vous parlez a plaisir et sans escri¬
pture. Il est tout uray quil y a en Le¬	pture. Il est tout vray qu’il y a en L’e¬
cõmencement diuerses graces ⁊ dons/ de	commencement diverses graces et dons/ de
science/ sapiẽce/ de prophetie/ des lãgues/	science/ sapience/ de prophetie/ des langues/
⁊ declaratiõs dicelles/ cõme il est escript.	et declarations d’icelles/ comme il est escript.
1.Corinth.12. Et tout cecy est pour seruir	1.Corinth.12. Et tout cecy est pour servir
ainsi Dieu a ordõne/ nõ point cõe uous	ainsi Dieu a ordonne/ non point come vous
dictes degrez de dignite ⁊ superiorite/ cõe	dictes degrez de dignite et superiorite/ come
il est de p̃sent: ou ung ignorãt est ꝯstitue	il est de present: ou ung ignorant est constitue
sus ung qui nest pas tant ignorãt cõme	sus ung qui n’est pas tant ignorant comme
nest si mal uiuant cõme lautre/ ⁊ tout ne	n’est si mal vivant comme l’autre/ et tout ne
sõt que dignitez ⁊ tiltres ambitieux. La	sont que dignitez et tiltres ambitieux. La
ou Apostre/ Pasteur/ Euesque/ ne sont q̃	ou Apostre/ Pasteur/ Evesque/ ne sont que
noms de seruice. Et ainsi parauãt Legli	noms de service. Et ainsi paravant L’egli¬
desolee/ sans Apostres/ Euangelistes/	desolee/ sans Apostres/ Evangelistes/
Prophetes/ Pasteurs/ Docteurs/ Lan¬	Prophetes/ Pasteurs/ Docteurs/ Lan¬
gues/ parauãt estoit entretenue ⁊ endo¬	gues/ paravant estoit entretenue et endo¬
ctrinee. Et y a eu de gẽs de bien/ les Apo	ctrinee. Et y a eu de gens de bien/ les Apo¬
cteurs: de quoy a present Euesq̃s ⁊ Pre¬	cteurs: de quoy a present Evesques et Pre¬
stres ne tiennent rien. Et uous ne cõtre¬	stres ne tiennent rien. Et vous ne contre¬
uenez uous point a tous ceulx qui ont	venez vous point a tous ceulx qui ont
escript? S. Ierosme na il point escript q̃	escript? sainct Jerosme n’a il point escript que
En lepistre a Tite dit: Idem est ergo	En l’epistre a Tite dit: Idem est ergo
presbyter qui episcopus. Le prestre donc	presbyter qui episcopus. Le prestre donc
est ung mesme que Leuesq̃. Et ne fault	est ung mesme que L’evesque. Et ne fault
que ceulx qui se disẽt de Leglise/ se ueul¬	que ceulx qui se disent de L’eglise/ se veul¬
sainctz personnages/ desquelz ne tiennẽt	sainctz personnages/ desquelz ne tiennent
rien/ non plus que Abrahã ⁊ les Prophe	rien/ non plus que Abraham et les Prophe¬
tes qui ont este deuant les Iuifz ne leur	tes qui ont este devant les Juifz ne leur
seruẽt rien: mais sont a leur condẽnatiõ.	servent rien: mais sont a leur condemnation.
nages/ ne seruent a ceulx qui se disent de	nages/ ne servent a ceulx qui se disent de
Leglise: lesquelz tous uiuent ⁊ enseignẽt	L’eglise: lesquelz tous vivent et enseignent
autrement que les Apostres ⁊ bons serui	autrement que les Apostres et bons servi¬
teurs de Dieu nõt enseigne ne tenu. Et	teurs de Dieu n’ont enseigne ne tenu. Et
stres ⁊ autres bons seruiteurs de Dieu/	stres et autres bons serviteurs de Dieu/
ueu quon faict ⁊ dit tout le contraire.	veu qu’on faict et dit tout le contraire.
Uous auez dit/ que Leuesque doit estre	Vous avez dit/ que L’evesque doit estre
mary dune femme: ⁊ est uray/ cõe le saĩct	mary d’une femme: et est vray/ come le sainct
Euesque estoit marie/ tout seroit ꝑdu/ ce	Evesque estoit marie/ tout seroit perdu/ ce
seroit la fin du mõde: mais sil a putains	seroit la fin du monde: mais s’il a putains
⁊ macquereaux la maison pleine/ qui luy	et macquereaux la maison pleine/ qui luy
iouent finesse lon nen faict que rire. Si le	jouent finesse l’on n’en faict que rire. Si le
peu de faict. Si lon passe le commande¬	peu de faict. Si l’on passe le commande¬
ment des Euesq̃s ou du Pape en uian¬	ment des Evesques ou du Pape en vian¬
des ou iours/ tous cryent au feu. Par¬	des ou jours/ tous cryent au feu. Par¬
quoy tous uoyent clairemẽt Dieu estre	quoy tous voyent clairement Dieu estre
hommes ont commande estans hors de	hommes ont commande estans hors de
la foy comme Lapostre monstre. 1.Ti¬	la foy comme L’apostre monstre. 1.Ti¬
